log_id,level,service,message,trace_id,ts
LOG0000193,INFO,auth-service,Amount back chair air discussion.,80f938e1-0907-4f1d-871d-df6f6e5cbc9e,2026-05-31T03:41:35
LOG0000194,WARN,tx-processor,When ever because relate ask it both study.,5701028c-d402-483f-b4a8-bfc22d945842,2026-05-20T10:07:53
LOG0000195,WARN,auth-service,Education thus ok professional toward yard dinner stuff artist.,848342e6-74ef-4e9c-a8a6-14b23adbb46b,2025-12-24T05:36:21
LOG0000196,ERROR,kyc,Fish together ask pattern structure newspaper.,5f1ab7c0-7d87-4aff-8745-3d740a7cfca3,2026-03-16T12:00:54
LOG0000197,ERROR,kyc,How house role area into near college.,ad3ce476-67c5-4976-aa42-bdeeb22a98e1,2025-10-30T23:31:45
LOG0000198,WARN,api-gateway,Must current tree evening others garden.,54d9e229-aaca-44ed-9089-3d01e620dc47,2025-12-06T11:54:02
LOG0000199,INFO,auth-service,Fund political film voice hand morning.,6c0421b8-9290-4b46-9e5e-e530c7a6b798,2026-02-15T21:28:57
LOG0000200,INFO,tx-processor,Movement however wrong by carry.,527b7440-7133-47a8-9b17-a07440ad7863,2025-09-22T18:50:34
LOG0000201,INFO,api-gateway,Quite million trip imagine much box just treatment technology show.,d68906fc-ceb0-489e-860c-6c371678d516,2025-08-17T19:51:18
LOG0000202,WARN,tx-processor,Will wide describe decision place develop.,a71406e1-0e47-4761-986c-eb3547fb57b4,2026-03-08T09:13:00
LOG0000203,DEBUG,auth-service,Good surface clearly civil stage let type billion could.,042988e7-9b3f-4e0f-9dc7-203c48fc9baa,2025-09-26T08:38:04
LOG0000204,WARN,api-gateway,Many administration peace imagine his step television.,f3de5386-ceb7-475f-b52c-346c721bf768,2026-05-21T18:33:20
LOG0000205,DEBUG,tx-processor,Let rise fact south painting.,735d64da-228c-4cf1-94f3-5e0370acdea6,2026-04-11T17:16:21
LOG0000206,DEBUG,api-gateway,Detail now mind should bring true some.,1a9ead76-38b1-4d36-b558-5497fa13708f,2025-12-28T18:41:32
LOG0000207,ERROR,tx-processor,Offer important if town other ever popular from together.,b9bc0321-5b49-4f36-a0c5-bfab7b15a794,2025-06-26T18:53:57
LOG0000208,ERROR,auth-service,Forward like still result case weight line discover win industry him.,ef513bd8-ba53-4636-9833-03a9c656129c,2025-10-09T04:23:20
LOG0000209,ERROR,tx-processor,Low discover history citizen generation wait pull leg significant type number.,2fd59560-a044-41e1-afaa-1b01e816a6d6,2025-09-20T03:20:34
LOG0000210,INFO,auth-service,Door act million cup future reach house off be.,d5189c53-0903-41c0-ad19-abcf9959606b,2026-05-10T21:55:42
LOG0000211,WARN,tx-processor,Inside rise rate create vote.,ab644750-9dd4-4c40-8405-cf4dd382af04,2025-11-07T09:19:55
LOG0000212,DEBUG,api-gateway,Where suggest yeah involve know seat.,cfcf8afe-6ef8-46f4-962f-c50c8dc6e285,2026-02-04T13:17:28
LOG0000213,INFO,tx-processor,Girl outside hear everything ask appear.,336affc2-f907-4eff-aadd-99f53efca671,2026-01-04T20:02:19
LOG0000214,ERROR,auth-service,Keep hot forget already until cup only culture.,db8a879c-a809-4b05-8a47-3b8d09f4a6a3,2026-05-24T03:44:14
LOG0000215,INFO,auth-service,Model more worker memory real outside important pretty.,f0bb02a0-c5c3-4f42-a05f-15ef50f08274,2026-01-06T22:33:50
LOG0000216,WARN,tx-processor,Explain letter news later energy treatment tend section.,18a1c4d9-5281-4a58-8dcb-c60819ffa986,2026-02-19T01:32:40
LOG0000217,DEBUG,auth-service,Offer act future this bar speak million my.,1a070192-78df-4163-8f6c-a999c2e83e27,2025-08-27T08:50:04
LOG0000218,DEBUG,tx-processor,Political specific indicate history avoid fine measure line concern writer.,a123905a-b7c9-46cb-81b9-2e3976ccadea,2026-03-30T16:01:42
LOG0000219,WARN,kyc,Real evidence dream style line.,f4f3649d-8159-4d3b-8a22-384e9861cbcd,2026-04-29T12:05:16
LOG0000220,INFO,tx-processor,Prove claim computer score community fast amount partner real shake.,afb0dbbc-0ab9-4d5f-9019-a8d557a80edd,2025-08-10T20:34:12
LOG0000221,DEBUG,api-gateway,Property easy safe many myself nearly little candidate international.,4d1bfece-7a40-4911-b292-83f15b8e7fae,2026-03-20T15:58:59
LOG0000222,ERROR,kyc,Along toward affect keep six expert buy single morning radio.,29c31dde-523c-43be-b626-6440d5d734e7,2025-09-19T20:34:53
LOG0000223,WARN,auth-service,Data nice organization usually concern thought myself.,3a4dc40f-2226-45b9-9e5d-05222aceedf7,2025-12-29T19:40:50
LOG0000224,WARN,auth-service,Window determine could these capital live thousand unit send fear.,f3607b8d-dcfa-4fda-ae01-defdfb1a351a,2026-04-10T06:50:22
LOG0000225,DEBUG,kyc,Successful remember behind over onto.,dbaabf8a-d0b4-4e4b-bde6-ec79cb335fd9,2026-05-04T11:53:51
LOG0000226,DEBUG,api-gateway,Site send hand on be imagine.,6094c46e-a9d6-4e15-9b3f-11af09d5691c,2026-05-21T16:11:47
LOG0000227,DEBUG,tx-processor,Where in before job quality good.,c3da9a58-ca73-4fd0-9d73-f33bc10ae36d,2026-03-23T06:05:44
LOG0000228,INFO,api-gateway,Your control town coach produce sing.,b1eb76f5-7a94-46dd-a140-8f73c761a1c9,2026-03-17T21:48:39
LOG0000229,WARN,tx-processor,Although energy specific past likely both suggest.,4103495c-025d-4506-8766-343f2baa5b49,2026-02-22T00:33:08
LOG0000230,DEBUG,tx-processor,Ahead idea together trade represent clearly home control them see.,9f19a610-b592-4e43-af21-b0d6cfc68a35,2025-08-03T09:14:21
LOG0000231,INFO,tx-processor,Blood different traditional drive exist company product evidence understand second.,26715d3d-6613-435b-91f2-f83ccd2cf7ea,2025-09-05T16:19:42
LOG0000232,INFO,tx-processor,High baby company successful develop with building behavior everything.,65fe05fb-b6a2-442e-b639-a1771daa1df2,2026-05-21T14:29:30
LOG0000233,DEBUG,kyc,Bed blue military ball lose occur.,667ae419-10bd-4742-99a6-70ead6b72684,2026-05-31T06:01:49
LOG0000234,INFO,kyc,Eye dog agreement go leg team young.,4499f000-cb19-4706-9c4c-44632a7a3bc1,2026-03-04T18:57:10
LOG0000235,ERROR,auth-service,Son knowledge article name method join kitchen factor store single.,8c60ff2a-40d4-4b51-9aa7-fa31c9a19d38,2025-12-25T10:17:13
LOG0000236,WARN,kyc,Final traditional probably world send yourself outside however area few.,f8d1ef17-b1ca-437b-9c80-5083b2fc3171,2026-04-08T22:00:07
LOG0000237,ERROR,auth-service,There be tonight by back future.,8e6272e5-1629-47f8-9011-3781130436e1,2026-01-07T16:52:29
LOG0000238,ERROR,kyc,But thank guess step value rich treatment.,ef27d240-87fd-4178-b05d-d681741eaeea,2026-01-03T20:58:01
LOG0000239,WARN,kyc,Deep well but agreement official both.,c268be5e-f729-4752-8965-6f1b28d352ee,2026-04-17T12:58:22
LOG0000240,INFO,api-gateway,North young six everything life common defense.,e3635c53-6ece-4c4d-98c6-a75d529e8a10,2025-06-30T00:15:29
LOG0000241,WARN,api-gateway,Together my or smile get writer network program crime difficult sea.,69561f9b-cb8b-41ac-874d-eaed45cf8753,2025-08-28T12:52:21
LOG0000242,DEBUG,auth-service,Before look old data practice life may opportunity themselves tree.,c29ff5ad-daeb-4f28-9916-ab9e169f3799,2026-02-10T21:01:18
LOG0000243,INFO,auth-service,Food interesting recent imagine life once tend.,94fcd266-9d0b-4fbe-8fee-edb9f9f4b88e,2025-11-12T11:36:34
LOG0000244,INFO,auth-service,Tough cultural cold the base student record best above five reach.,b7f9a272-527c-4de1-a026-f6a61bdf772a,2026-03-22T03:49:42
LOG0000245,DEBUG,auth-service,Thing wonder imagine two defense.,3f6312e7-effe-4da7-8915-17d64ee01702,2025-12-25T15:38:00
LOG0000246,DEBUG,kyc,View traditional head focus sign truth main probably people.,868d6292-01a4-4e3e-b6c8-de7249e63ea2,2025-11-11T10:49:29
LOG0000247,INFO,kyc,Artist wish camera and bad beat scientist attack simply worry.,a7de4ebf-dd64-4e1f-9a80-5d26c56bdc7e,2026-06-06T20:22:19
LOG0000248,DEBUG,tx-processor,Easy different too skill almost opportunity.,e1c3008e-3fb3-46aa-a8f4-35c330891d61,2025-11-19T03:12:07
LOG0000249,WARN,tx-processor,Money away present let record own enjoy.,961779fc-e127-4bd1-a725-57fd24a3072b,2026-04-11T04:50:52
LOG0000250,DEBUG,tx-processor,Enjoy skin consider computer still administration community.,a0a700d8-9806-4f7b-996f-6b315272f653,2025-12-03T18:21:36
LOG0000251,WARN,auth-service,See turn action decision miss its choice unit feel impact.,540f8294-1412-49df-a940-f14c4a43f7a0,2025-08-24T10:36:26
LOG0000252,WARN,tx-processor,Wife conference against data concern.,aeed1905-53e7-4ad1-812a-80440efda4ce,2025-07-05T04:45:40
LOG0000253,INFO,kyc,Dinner writer individual save bring.,367cefa3-68bf-4a15-819f-331f4ff9e2a4,2025-10-08T05:05:48
LOG0000254,WARN,tx-processor,Cultural discussion fire outside focus weight enough boy.,1a42ae41-b398-4713-bd59-ae0e4ae72d19,2025-08-16T16:17:29
LOG0000255,INFO,kyc,Make any place capital method writer son receive force campaign word.,f9f0501f-2fdb-4254-9ea8-2b74ff167c08,2025-06-21T23:34:25
LOG0000256,INFO,tx-processor,Consider through guess method coach score something base edge.,d4434fe4-4672-4882-baaa-841ad858c11d,2026-02-27T10:46:14
LOG0000257,WARN,auth-service,Tax Republican local foot south beyond.,e56abd33-e7db-421f-9de2-c37cebd17765,2025-08-08T04:52:17
LOG0000258,INFO,auth-service,Shake responsibility modern shake animal audience.,48732f0c-b016-40d0-883c-eda4a0954a98,2025-09-20T03:13:48
LOG0000259,DEBUG,kyc,Wait green life decade mission who work well.,a0585c6f-75f4-47a2-b68b-46212ef6e0b8,2026-03-23T18:13:32
LOG0000260,WARN,tx-processor,Affect role run vote usually be shoulder work whatever attention.,75a65983-08db-4e0c-9c00-e6132c43338b,2025-10-01T07:57:46
LOG0000261,DEBUG,tx-processor,Subject environment product seem visit.,cb6a72fa-f67c-4041-b6fc-4c0eec05f6b3,2026-06-03T08:49:37
LOG0000262,INFO,kyc,Or member plant ever everything.,5e792faa-dd3b-4b17-90be-00f1a7cb42f6,2025-06-23T01:48:58
LOG0000263,ERROR,api-gateway,Claim require my police woman act meeting.,2db68e01-677b-42e5-8cbe-bcd705620464,2026-04-20T08:28:52
LOG0000264,DEBUG,auth-service,Cut culture write quite hand event ever.,5a722ce7-71d3-4dfc-bbe6-9b07c5be87f9,2025-08-15T13:20:17
LOG0000265,DEBUG,auth-service,Appear middle give few popular imagine maybe window.,776eef5e-5f1e-41b2-87b9-9f6775046de4,2025-09-20T12:02:17
LOG0000266,INFO,api-gateway,Unit contain father state continue.,a3f021cd-3d22-4159-9bbc-c40753aa02d9,2025-10-01T16:02:25
LOG0000267,WARN,kyc,Key training term become child prove reveal represent yes.,37446858-30e1-43af-9e88-f1e18f3c4bb0,2025-08-10T03:16:40
LOG0000268,INFO,kyc,Director including investment answer.,b1d78659-9986-481e-9a88-df7be4f17e27,2025-08-31T15:32:42
LOG0000269,DEBUG,kyc,Continue sense whatever few stay partner myself drive show.,94fe5ef1-2931-409c-8fb6-d1914c618861,2026-05-27T06:32:36
LOG0000270,WARN,auth-service,Themselves everyone beautiful someone close news.,8c1b4a1d-cdbc-4d13-ab0a-e7b06658762d,2026-02-14T23:56:06
LOG0000271,INFO,api-gateway,Reflect five front fast charge stop ago spend set south.,19964e6c-0a3c-4b39-ac9d-ae4bbc7f459a,2026-04-09T02:47:33
LOG0000272,INFO,auth-service,International picture example television home.,3d1101b6-9ba7-42a1-881d-858a803eff9a,2025-10-29T13:26:43
LOG0000273,WARN,auth-service,Think resource society kind month cause.,3ea35583-fead-490f-a171-313c77f27982,2026-01-22T09:58:38
LOG0000274,DEBUG,api-gateway,Everybody walk what example tonight woman.,1ccf29fd-157a-467b-b624-327d78f79da8,2025-09-11T06:59:20
LOG0000275,ERROR,api-gateway,Party response will form resource need cell player.,fa9bf755-d9bd-402b-94b4-3f88d623e08c,2025-06-24T14:41:01
LOG0000276,DEBUG,tx-processor,Really degree husband visit Congress police.,4655f2b7-a27f-4422-b680-14b4c1b48a18,2026-01-25T08:20:18
LOG0000277,DEBUG,auth-service,Yes book best arrive rate business program resource.,2b312ede-7509-4710-90ba-4954fd8408be,2025-09-15T12:08:25
LOG0000278,ERROR,api-gateway,Stage Republican skill significant agent impact reality lot.,2ce5eafa-2b1d-45a4-80db-8e5aa80081c1,2025-12-11T11:21:31
LOG0000279,ERROR,api-gateway,So capital prepare international difficult it much focus.,51a87a82-9d4a-43ab-a45a-ee926a348aa2,2025-11-08T09:42:35
LOG0000280,WARN,api-gateway,Compare citizen once up finally shake attack guess.,942cf805-7338-48c6-99f4-540fa0be8ea0,2026-02-12T17:48:56
LOG0000281,WARN,kyc,Military decade computer meeting forget gas sing million public property.,4124ff50-dd01-4987-9377-e055725e6b7d,2026-05-27T18:48:23
LOG0000282,DEBUG,kyc,Sense manager who management a assume big.,a793f616-fb9d-4cc3-8022-0ead9062c48a,2026-02-26T11:32:42
LOG0000283,ERROR,api-gateway,Identify pull system price away hot source.,69bf44f5-1207-4d59-b961-691ad79ca87c,2025-06-16T19:26:22
LOG0000284,ERROR,tx-processor,Receive final mother everything fire close edge theory nation arm.,a8368f30-d155-4a4a-ac10-029db9f30dd5,2025-11-06T00:58:10
LOG0000285,ERROR,kyc,Alone eye method successful themselves back prevent small put know.,eccf9074-b39f-4fe8-a2b3-250f5efa0672,2025-10-23T00:50:10
LOG0000286,INFO,auth-service,Just these walk house protect worker project mention.,5f7cfd07-23de-4a1f-aa86-d7cee9d8a7dc,2025-07-20T05:55:46
LOG0000287,DEBUG,auth-service,Against foot hit drop reveal happen detail cold dark physical.,589d2ade-336c-49f2-ac9e-ed9cafea229b,2026-02-11T01:10:49
LOG0000288,WARN,api-gateway,Tonight happy order choose.,9ab19619-99c1-4345-a667-24bd6a63c49a,2025-11-27T05:03:43
LOG0000289,WARN,kyc,Care what rich board collection prepare.,5970b112-55e8-4017-b2b0-a379d86f27a4,2026-03-16T08:23:21
LOG0000290,WARN,tx-processor,Democrat report song government far second machine.,1c567650-4eee-4550-97da-6005da8eaac9,2025-11-15T02:57:12
LOG0000291,WARN,kyc,Page involve together health girl yourself tend key region grow modern.,c5336725-ef67-4358-8650-f683a1941e58,2025-06-14T17:26:54
LOG0000292,INFO,auth-service,Friend check heart easy.,5b40d46f-9cde-4168-8ed2-4cfca7cfb488,2026-04-24T06:15:56
LOG0000293,WARN,auth-service,Third forget job thought enough ground.,c62e681d-cbab-48ca-a373-23b915a2f8d7,2026-05-21T14:54:17
LOG0000294,INFO,tx-processor,Power major reality fund store century about.,81cb5f8d-1a17-498a-a641-7beee9d702bc,2025-07-02T14:41:15
LOG0000295,WARN,api-gateway,Mission analysis save summer energy.,cf254bc9-78ed-41c0-af4c-af7fa4f87087,2025-10-04T22:07:34
LOG0000296,WARN,tx-processor,Similar medical window enjoy require.,4e53e398-cca6-40ba-b3e3-bb6cce877672,2025-10-12T06:47:02
LOG0000297,INFO,tx-processor,Shake sit around deep protect.,e84d754c-20ed-4344-a1b7-ec8141e1b6b6,2026-05-06T11:19:33
LOG0000298,INFO,auth-service,Anything believe reach many.,38dc8962-b9ee-4145-9207-e19a88d47871,2025-08-11T21:00:52
LOG0000299,WARN,auth-service,Culture herself work particular certain operation me wind radio administration.,aea56299-15a8-43c9-a36f-e7a6174f0cb5,2025-08-13T18:01:01
LOG0000300,INFO,kyc,Lot start raise international prove top range music partner.,0a8c248f-756f-4eaa-87bb-70710973936a,2026-03-20T04:56:27
LOG0000301,INFO,kyc,Claim especially political company find.,f7665d6c-ee10-475c-a6cf-248c48ebd43c,2025-09-06T10:02:14
LOG0000302,INFO,tx-processor,Could state sense use condition I newspaper bit guess yes.,fc13523b-e9fa-44da-b3d2-b2b61177232a,2026-02-12T21:16:24
LOG0000303,DEBUG,auth-service,Perform sea road radio agree serious section.,f95e999d-d87c-4bd4-a661-0b71527e5f8d,2025-10-31T18:09:00
LOG0000304,DEBUG,auth-service,Thought beautiful show consumer significant consider force wear.,a0b30056-61c4-48ec-a72f-479064be181a,2026-03-29T16:15:29
LOG0000305,WARN,auth-service,Enough article want be hair experience magazine too clear strategy.,4bfb5917-a611-4b3f-947e-a603a1a645fb,2026-01-09T13:07:08
LOG0000306,ERROR,api-gateway,Drug both head similar sea television popular consider hotel.,d20639e3-9c3a-4abd-9ac6-3397b3d142dd,2026-01-02T07:08:15
LOG0000307,DEBUG,kyc,Staff nature north play hot main part owner.,6e79a98b-e78a-4051-b1f0-364b5d19d348,2026-01-02T10:20:48
LOG0000308,ERROR,auth-service,Fund game voice tend form share.,1351936f-9b56-468b-85fe-fe29fde6eaf6,2026-05-12T18:52:22
LOG0000309,DEBUG,tx-processor,Loss audience study million anything.,8fa7a740-ca25-44d8-8001-dae95b7445ee,2025-08-03T08:55:47
LOG0000310,DEBUG,tx-processor,Apply score create discussion discover.,04fabd96-6828-4644-8ae0-3eee8e72dcbb,2025-11-23T21:20:24
LOG0000311,INFO,auth-service,Church bit we buy if wonder city sort radio expert.,01846b5f-cbac-4474-b8d6-4e05f94b0b6e,2025-09-27T17:12:45
LOG0000312,WARN,tx-processor,Say good risk manage machine policy.,340ea908-f7f7-4a87-bc13-34147b2a2882,2026-05-25T12:47:40
LOG0000313,DEBUG,auth-service,Bag environment big very.,18de14b2-f114-45bd-8bbf-0f0aeef213f4,2025-08-28T01:55:59
LOG0000314,DEBUG,api-gateway,Various concern option most beautiful billion throughout say million several.,d7c5d38c-1fd8-43d1-afc4-b39ee47b0c80,2025-07-03T05:23:56
LOG0000315,ERROR,auth-service,Modern organization research market ask someone level ever.,99ec55d6-46a1-4998-8b54-0ee7b93f56ab,2026-05-06T00:47:52
LOG0000316,DEBUG,tx-processor,Prove despite send oil.,4c4f73ca-271c-4fd5-945f-09e08f16797a,2026-02-16T17:49:48
LOG0000317,DEBUG,tx-processor,Recognize rest outside modern site that paper project.,47725082-ea09-413b-b87c-51f73f0bcd44,2026-02-10T06:33:50
LOG0000318,ERROR,api-gateway,As leader majority laugh ahead long maybe.,68b7838b-69a1-4a90-b3d9-76c6a01e07b8,2026-03-07T15:17:37
LOG0000319,DEBUG,api-gateway,Husband seven write their including range middle people hit.,6c3ad66b-f2fe-445e-95d9-b8863a59e71e,2025-12-29T21:26:04
LOG0000320,DEBUG,kyc,Thank big protect standard rock bank book.,3378b7ae-ff17-4083-a123-ed9661217801,2025-09-26T09:35:42
LOG0000321,INFO,tx-processor,Take sea few take financial main lead.,cd97efd4-5743-4439-88ad-c31748f6f882,2025-08-28T05:23:02
LOG0000322,INFO,tx-processor,Article college age hot candidate bring join woman open single.,67f17b5b-767d-48c3-a195-1f2adf7d3614,2026-02-06T12:58:43
LOG0000323,ERROR,kyc,Office determine cause decision score size popular fly.,5851db48-f82d-4265-98a5-f111e4aa034f,2025-06-23T02:36:36
LOG0000324,WARN,auth-service,Such month to land civil nature off focus learn tonight.,fab2e497-c192-47c1-9fca-6fde882d723f,2026-05-12T04:07:40
LOG0000325,WARN,tx-processor,Product stop resource cause ball art challenge which skill catch.,e9c00177-1180-4f53-9e3c-f1caf6746a2f,2025-11-24T18:53:44
LOG0000326,INFO,auth-service,Onto town continue region threat force remain.,18ab9672-3370-4b50-8975-06d3053f2292,2025-06-15T12:05:38
LOG0000327,INFO,kyc,Material Congress friend whether worry charge phone.,65b0e133-8a13-47c9-a3f7-508f31c7f004,2025-07-14T14:52:30
LOG0000328,ERROR,api-gateway,Send determine market owner happy nearly down find.,b7d7e06a-5de4-4696-9746-d504c0b22c60,2025-10-29T02:48:50
LOG0000329,INFO,kyc,Former moment population parent become.,496a93ef-5db7-44b2-81ef-f715f51d8b38,2025-11-15T20:35:32
LOG0000330,WARN,api-gateway,Ball serve walk speak its after effect opportunity black under trade.,f0823119-e7a7-4012-8cd9-993d6d982de4,2025-10-24T04:13:45
LOG0000331,ERROR,api-gateway,Somebody small foot month father seat reason.,e90fb5e5-7ce7-45c3-976b-e655b373aafd,2026-05-08T23:14:42
LOG0000332,DEBUG,auth-service,Agent drug generation arm buy fish sometimes.,7d8b130e-a448-4d9b-ae28-117bb04535e2,2026-02-01T16:46:02
LOG0000333,DEBUG,tx-processor,Artist go because two this bank be newspaper.,47079562-df11-4306-a82d-2e2f3ef015f2,2026-01-06T02:36:05
LOG0000334,WARN,api-gateway,Official ahead during performance receive.,b03874ba-9cad-4718-acb6-4f8d6b36a599,2025-08-16T00:40:00
LOG0000335,ERROR,auth-service,Into outside until teacher western.,39327c5e-4111-4909-b0b5-d722099b4ea6,2025-09-22T03:21:20
LOG0000336,DEBUG,kyc,Film home tough change treatment difference million real minute.,efbfbef3-c6ac-4a49-ac82-c726ff9a502e,2025-06-20T07:14:22
LOG0000337,WARN,tx-processor,Record create agency former family be series stay.,11c43d2a-0811-48c7-8d6e-bd89f269bf13,2025-09-30T18:53:26
LOG0000338,DEBUG,kyc,Account other coach purpose.,f657d84e-1eb0-4196-b1c8-55a09abbb507,2026-04-10T09:30:22
LOG0000339,ERROR,kyc,Computer several position score too main adult reason.,0c942d55-0393-4d95-bdbc-332fc2d25201,2026-02-16T04:13:35
LOG0000340,ERROR,api-gateway,You read shake science analysis quickly see something child.,512d0a04-a904-49bf-9762-2dc116ac0e02,2026-05-27T16:29:59
LOG0000341,WARN,api-gateway,Mouth board white require second blood PM.,de957a4f-bc33-4650-abb4-44c3c91e1093,2025-12-10T11:37:54
LOG0000342,INFO,tx-processor,Should coach result force course technology speak look protect.,1e9c0e06-50ee-4a0e-adcc-9022c79bd7d0,2026-04-20T13:19:21
LOG0000343,WARN,tx-processor,New war take spring report down author.,667f3cdb-4d39-443e-96f1-85265b82c16d,2026-02-26T18:32:49
LOG0000344,WARN,auth-service,Tell result worker somebody six close mother grow finally.,bfe9b074-0b4d-48b1-bbad-c813d4da2e89,2025-06-16T14:48:53
LOG0000345,ERROR,tx-processor,From size design teach author.,dbff6509-be2f-4911-b483-6ce56d745680,2025-11-11T06:33:10
LOG0000346,DEBUG,api-gateway,Option today identify career coach expect left.,6b56ca24-9e9e-426f-a910-7dadbf788e4b,2026-04-18T11:54:01
LOG0000347,INFO,tx-processor,Usually build stock individual with movie situation.,823c97cc-1b2d-41d8-a1ac-c626b77b7cba,2025-10-15T07:21:43
LOG0000348,ERROR,tx-processor,Skill international could provide economic anything phone big where including.,43048c3b-dbf0-44cd-85f6-f3535cf1d2c2,2026-03-07T19:33:36
LOG0000349,INFO,kyc,Bill feeling foreign education manager.,521488de-cb76-4cb0-a292-0f2a999f9396,2026-05-20T19:32:41
LOG0000350,WARN,tx-processor,Positive staff green set.,8c4042b8-1b7b-41f6-a92a-4bf54ae93c75,2025-06-16T13:47:40
LOG0000351,DEBUG,auth-service,Environment something could buy mouth least everybody here.,70591237-60fd-4632-a9e0-4524e3b59ff0,2026-04-13T15:42:44
LOG0000352,WARN,tx-processor,Social left main white hard dream feeling throughout.,04b4ebab-8db7-42c9-b115-f10e25f21790,2026-04-21T05:27:06
LOG0000353,WARN,auth-service,Team modern should take mission wind affect minute condition.,504ec768-d6bf-4cc1-9455-8ff390acade0,2025-09-16T22:21:23
LOG0000354,ERROR,tx-processor,Including provide over whom difference care mother forget local.,784f2fa9-9ef8-4574-954c-6a301d19b6c8,2025-11-04T05:15:44
LOG0000355,INFO,api-gateway,Himself rather return check cell.,4eacd1ae-fa6e-4650-b17b-b49751f40ee4,2025-06-23T08:56:10
LOG0000356,ERROR,auth-service,Hold air authority side car build property as.,3b7a7188-2867-4116-82be-6fb34f6e97a3,2026-04-21T19:54:40
LOG0000357,INFO,tx-processor,Amount change store town ok until fill audience west music.,e66ff1d1-1a98-4837-a3fa-00c4535bcc2c,2025-06-16T03:29:21
LOG0000358,DEBUG,auth-service,Site charge everybody growth hear left contain young.,9041fc16-cfda-4350-b8ab-34f5834b96f2,2025-09-07T13:18:41
LOG0000359,ERROR,auth-service,Industry risk each station end.,02972a32-70e9-4994-89e0-05486a2ab40c,2026-04-12T07:46:13
LOG0000360,WARN,api-gateway,Charge pass bring close because agree born he strategy interview report.,e6e6f5eb-539b-4633-a0bb-34c8d07a5866,2025-11-03T12:18:57
LOG0000361,INFO,api-gateway,Nation identify situation note impact own piece star health your.,fc597dba-4c43-4cc7-b81b-f8a45e3549bc,2026-05-16T23:26:54
LOG0000362,DEBUG,tx-processor,Plan style different along local hour alone option.,b85c31c6-bcec-4888-9041-f0c2b1879560,2025-11-15T13:04:36
LOG0000363,WARN,auth-service,Certainly baby authority toward ask eye contain.,ae5dafaa-7177-403c-95a9-61bf2723de0e,2026-05-25T09:23:12
LOG0000364,ERROR,api-gateway,Brother statement huge anyone investment meet pretty base.,d899ac8c-441c-446c-b985-a0dbb91f942a,2025-08-01T15:08:22
LOG0000365,WARN,kyc,Scientist trial situation summer real significant group debate management or.,eb971f04-724f-4db2-97b1-ac280820230b,2026-04-17T04:34:41
LOG0000366,INFO,tx-processor,Own after individual environment entire strategy go mother.,e47f5596-b06a-4d85-acc0-911ed5e663f2,2025-06-27T05:28:04
LOG0000367,WARN,auth-service,Drive adult green character voice establish participant today build training.,91d9a40e-a9dd-4cf2-99a2-9bcaa646493c,2026-04-07T15:24:51
LOG0000368,DEBUG,api-gateway,Goal single five bring recently impact government now city.,2815cb50-1631-4472-896e-3a16f9abab33,2025-08-07T01:09:39
LOG0000369,ERROR,api-gateway,Fly during help rather environment health class fund security effect work.,619128b7-5944-422b-94b7-b602e8714c85,2025-12-18T11:48:17
LOG0000370,WARN,tx-processor,Local current total rest pull bag need shoulder office.,9ba17b4a-b42d-4e32-97c4-397935bc5d95,2026-01-28T04:29:21
LOG0000371,ERROR,tx-processor,Simply which responsibility bed ask American per meeting democratic thousand.,64468a00-9d46-4fb1-b24e-9296b650309a,2025-09-30T22:24:25
LOG0000372,ERROR,tx-processor,Once medical lay too view.,f0f4aa60-fd6c-4867-885d-2ab09d1704aa,2025-09-29T03:47:19
LOG0000373,DEBUG,auth-service,Without itself mission speak.,c8530e89-f3bd-4fb1-b52f-94a79cd3d76b,2025-06-12T03:16:35
LOG0000374,DEBUG,tx-processor,Imagine into can everyone south bag.,bca98712-7fe8-4599-bcfb-6ac0a62aed61,2025-09-15T11:07:22
LOG0000375,ERROR,api-gateway,Smile memory meet age present data create trade.,f1284ac2-095a-4ef0-b14b-16651fd4b38a,2025-08-13T19:16:57
LOG0000376,INFO,tx-processor,Suffer price life back say account.,ef48a4ed-ccaf-48d4-8bfd-7d4aa79284f7,2025-08-01T03:31:33
LOG0000377,INFO,tx-processor,Program police economy lay somebody study.,25332fea-2274-4822-984a-75a552116ba4,2026-02-07T13:22:35
LOG0000378,DEBUG,auth-service,So fine want send across control wonder ok.,c172f6fd-03ac-403b-8c2f-0ca012731b82,2026-03-05T19:21:45
LOG0000379,INFO,kyc,Term find administration he more skin front.,86e75d73-3b42-4310-ad38-eb05ae0ac4c2,2025-06-28T23:12:51
LOG0000380,INFO,kyc,Alone pull something effort husband senior.,71701e0b-a12e-45d1-933f-f17db1286850,2025-12-01T14:43:26
LOG0000381,WARN,auth-service,Hot wife tonight third political writer.,aab30979-ed38-4b9b-a206-ea18d553b964,2025-12-04T09:07:46
LOG0000382,DEBUG,tx-processor,Party Republican everybody him customer middle out fact.,0344c564-aa0a-4170-ac31-fef37c5cd91e,2025-12-24T11:51:28
LOG0000383,ERROR,auth-service,If watch hand where million network fear control total artist.,af04253c-626d-45a2-ac2c-1fff75f47c8e,2025-10-22T22:01:37
