log_id,level,service,message,trace_id,ts
LOG0000769,INFO,kyc,Management when able direction young actually two court south home.,52010834-f477-4418-a4ea-22352f6b1d7b,2026-05-07T13:34:33
LOG0000770,DEBUG,api-gateway,While view building body something only thus because.,832138d4-fd57-4554-9044-996db1b1f984,2025-06-23T21:45:20
LOG0000771,ERROR,api-gateway,South project indeed letter yes themselves.,6ee911d0-5c60-496d-8fc3-95869cf3008e,2025-12-03T20:09:26
LOG0000772,ERROR,tx-processor,Challenge account set pull moment that model owner.,feb6ca4f-26f3-4cc0-9faa-5bdbfdec502a,2026-02-12T03:19:53
LOG0000773,DEBUG,api-gateway,Need movement condition fish special response actually Mr choice how.,fca909e9-46d1-4136-b5a8-ed91115041e4,2025-10-06T10:10:44
LOG0000774,DEBUG,tx-processor,Around order challenge morning although successful full floor usually especially.,17ebaf4a-d955-4750-bc90-951348f974e0,2025-10-30T16:49:49
LOG0000775,WARN,kyc,Grow whatever Mr happy attention eat.,49352044-27b0-4419-be3c-9c86684b414a,2026-01-10T02:44:54
LOG0000776,INFO,auth-service,Already rich answer tend morning career receive.,935d2d8f-0e7a-42f1-b070-b75e13218915,2026-05-17T09:24:31
LOG0000777,WARN,tx-processor,Not rule democratic election.,cce8b1e5-8dfc-4282-af49-4daca28f28c5,2025-12-11T23:10:55
LOG0000778,ERROR,api-gateway,Main require move when forward half wish.,e7a99287-3140-4b6a-90cb-e4746b0fd11d,2026-03-03T12:05:02
LOG0000779,INFO,api-gateway,Technology out say feel wide.,d4bdfcca-39c7-48f7-b5d1-cf56f262f954,2026-05-28T18:08:34
LOG0000780,ERROR,auth-service,Wall today style to institution kind business protect thus or.,5205d0c8-0324-4741-98d0-578c39e83134,2025-07-06T20:12:14
LOG0000781,WARN,auth-service,Next take by deep response investment.,a41f29bb-2c4e-4e69-9cf0-5a698e3429b2,2026-03-04T17:33:54
LOG0000782,INFO,auth-service,Cultural better save pass Mr hope.,5b2c78a6-1654-4091-8345-30017473a4f7,2025-11-03T19:29:19
LOG0000783,DEBUG,auth-service,Happy light employee research always person.,9846dfdc-4e78-4ff3-838b-313cfe4e1655,2025-10-27T01:43:03
LOG0000784,INFO,kyc,Chair fish end shoulder instead.,f9fa8ed4-4361-435d-8b1b-90ea6a1d4b3a,2026-02-11T04:05:17
LOG0000785,ERROR,auth-service,Bit main production today hand.,2ce3c82d-f399-40ef-831d-639f28c445e3,2026-05-22T20:12:02
LOG0000786,DEBUG,tx-processor,Partner by likely page believe control.,d3622207-9ae7-46c1-a918-2bd423b5985a,2026-01-06T20:16:03
LOG0000787,WARN,auth-service,Glass figure maintain development analysis indicate watch bad.,054525ae-feee-440d-b8a5-2a4ce50e41b6,2025-11-06T23:35:44
LOG0000788,WARN,auth-service,Congress worry shake most mean order.,6d6f55cb-0c19-4234-9835-ea6a41540517,2025-09-04T02:59:01
LOG0000789,ERROR,kyc,Check life indeed idea course new letter production rich.,dacb1479-36ca-4c00-b577-e345b9eb02fd,2025-11-17T13:01:40
LOG0000790,INFO,kyc,Card message long support decision purpose again another medical.,31e6e769-0528-4a3d-87ec-0f52d7edd13b,2026-02-11T11:42:52
LOG0000791,DEBUG,api-gateway,Dark stand suffer billion action surface hope home.,dc577780-c5b1-4377-b9f8-12837bd6e444,2026-04-26T23:27:10
LOG0000792,ERROR,api-gateway,Your around as animal citizen off.,6be8e2fd-a8da-417f-9c50-7f38eec282ad,2026-02-16T11:51:20
LOG0000793,INFO,kyc,Idea culture short class color else.,c23c0184-fc8b-455e-beec-22ce6acbf6fa,2026-01-22T17:20:45
LOG0000794,WARN,auth-service,Medical history high result vote expert officer authority affect reason.,f274da43-f5db-4da9-bedd-bec086647f83,2025-07-05T19:50:11
LOG0000795,DEBUG,auth-service,Ability sea west lot try.,6a02d40e-1e19-42ff-9531-0e4a9044caef,2025-10-31T16:01:18
LOG0000796,ERROR,tx-processor,Test concern analysis between unit pull democratic can gas board.,7f27e84a-5a56-4834-b5fc-42d4026e1c00,2025-10-27T16:32:25
LOG0000797,DEBUG,api-gateway,Board by no answer be control whatever.,a61cdea6-c2b2-480b-ba79-1048294516b0,2025-06-15T12:51:07
LOG0000798,DEBUG,tx-processor,Choose entire despite wrong write morning election together responsibility.,03a932c4-f43a-433c-aae5-0b001c76b173,2026-05-22T18:34:31
LOG0000799,DEBUG,auth-service,Room decide pull past factor end should so total.,a0eae939-aa6d-40e7-b25d-1e79203090e1,2026-05-17T09:41:58
LOG0000800,DEBUG,kyc,Structure space give look first assume.,6d8cae6b-38e7-44bc-b8a8-92ee27a257be,2026-02-21T17:45:17
LOG0000801,ERROR,api-gateway,Board institution use cut.,2032d980-b785-4d0e-b3bb-cba258e8d99b,2026-04-09T11:02:37
LOG0000802,WARN,kyc,Record wait power affect discuss exactly late what building.,7dd6dd27-89bf-4a77-9a8b-b3fef7b7ebef,2026-04-29T14:39:00
LOG0000803,WARN,tx-processor,Bad mission break world six crime.,1629eda6-e74f-4543-ad87-981a0b5f2c07,2026-04-24T19:36:37
LOG0000804,WARN,auth-service,Age lot fall possible everyone.,dd4374a4-00a9-4083-ae68-bf844e9a2384,2026-02-15T19:47:31
LOG0000805,WARN,kyc,Six scene forget lot consumer child.,fbb8fb63-c6db-48ca-9c75-3a3835ee5bae,2025-11-15T22:05:12
LOG0000806,INFO,api-gateway,Option official remember effect pay.,200a139c-e06a-4895-a2dd-b10b8a047bf5,2026-02-19T14:11:13
LOG0000807,INFO,auth-service,Trouble public production free owner myself growth stop necessary trouble.,b6696624-73f8-4f5d-9fd4-aab00f7c639c,2025-07-22T21:22:35
LOG0000808,DEBUG,tx-processor,Add only talk somebody option listen body huge put direction.,2f19f67d-b6ad-471a-b43e-8d8e6d1ef26f,2025-06-12T14:09:06
LOG0000809,INFO,api-gateway,Language meet have keep response contain.,9022cfd5-0169-4875-a8c3-00a790d324b6,2026-03-21T02:15:26
LOG0000810,ERROR,kyc,Scene than arm station husband.,81ea4f78-2673-4a3d-ba05-ce259911c0e0,2025-09-03T21:59:50
LOG0000811,INFO,auth-service,Safe prove effort else thousand our.,f4e309b7-15ed-4413-af62-809f8ccc8a5b,2025-11-12T00:49:57
LOG0000812,WARN,auth-service,Follow yourself wall let shoulder event recent maybe six include.,b4b64a73-e1c6-4118-939e-1e019ae0458d,2025-09-16T21:05:31
LOG0000813,ERROR,kyc,Job reach north avoid then firm.,af85943f-4f9f-4feb-9d68-22519834db48,2025-12-20T11:51:42
LOG0000814,ERROR,api-gateway,Bar room future ago marriage consumer.,d9c025e8-c3ed-4bde-bed8-5ee2902038af,2026-06-08T12:40:25
LOG0000815,WARN,api-gateway,Around put himself wide support operation.,89a608c3-ccfe-4d3a-b313-8ef250b27716,2026-04-27T12:47:49
LOG0000816,INFO,kyc,Old magazine team candidate play suggest but charge big.,41c5e072-9517-4165-884b-00828ee075e0,2026-04-04T22:52:04
LOG0000817,INFO,auth-service,Through job wife find late candidate.,7f1dae4a-c8e2-4c4c-9adb-db884983a49f,2026-01-18T19:46:16
LOG0000818,INFO,auth-service,Possible section would positive model morning with.,f6fd4ac2-e6af-472a-9563-e8df00ccb27d,2026-04-25T17:09:17
LOG0000819,DEBUG,kyc,Religious expect drug wear will.,6e7587fd-9928-4236-89c0-96b7ce04d5fe,2026-05-26T10:00:51
LOG0000820,DEBUG,auth-service,While state special off senior cultural long raise travel.,989af324-341c-4bbd-8d13-b2730a5a526d,2025-12-01T04:15:46
LOG0000821,INFO,kyc,Wonder serious purpose main most our amount.,f82399a2-d796-4c1c-9362-6e2b0a143b14,2025-08-02T04:41:02
LOG0000822,ERROR,api-gateway,Lead between leader must land charge movement around.,afdd3016-d02d-48d5-b789-7c030b9167fd,2026-02-05T08:52:02
LOG0000823,WARN,api-gateway,Film information cut southern score car near hold building.,c556a919-2603-4016-b47c-edef8ebdfeb9,2025-09-22T14:29:02
LOG0000824,ERROR,kyc,Letter investment by build degree late.,e2a95c81-df8e-4c1a-92d1-f25f0ede5c5e,2026-05-15T20:13:51
LOG0000825,INFO,tx-processor,Media campaign five today leave stuff hope college.,d3333a27-e6c0-48b6-a058-ebb7b9b6d521,2026-05-12T11:53:17
LOG0000826,WARN,api-gateway,Week hear simply arrive gun.,8a8c23f1-c10c-4fe8-a089-35a3a87ad928,2025-06-27T16:18:44
LOG0000827,INFO,kyc,Difficult usually role feeling weight cost thing today.,17972a29-d4fa-47d5-8e41-9449a7770ef2,2025-10-06T00:00:10
LOG0000828,INFO,api-gateway,Factor left hair money camera fire child can name relate.,4f7c98a7-8db8-42ce-bab6-7c1ed940d098,2026-05-09T19:01:06
LOG0000829,DEBUG,tx-processor,Development represent again class need best music half bag image.,373468c6-be60-4c4f-a29b-7873af05bf9c,2026-04-16T18:13:12
LOG0000830,DEBUG,api-gateway,Maintain morning seem process tell break good none data fish.,3e446615-f84d-4305-9029-edcd3602baf9,2025-11-20T19:14:57
LOG0000831,DEBUG,kyc,Customer stand personal quickly response owner health likely indicate.,141f4aa0-9049-4db3-90a0-17228a8b5269,2025-09-16T23:46:52
LOG0000832,ERROR,tx-processor,Suffer oil pass work employee.,744deb10-b83d-4b61-8228-163a3ae2d53c,2026-03-21T14:32:25
LOG0000833,WARN,kyc,Clearly guess minute challenge activity.,fb77c38f-3ac0-460c-98b1-27c0950ff6a9,2025-07-18T17:41:13
LOG0000834,WARN,tx-processor,Interview develop opportunity well investment citizen billion sit.,8c58cef6-ef3a-4260-a25c-c42dc531bcfe,2025-11-02T15:12:47
LOG0000835,DEBUG,kyc,Happy bill seat another reach tonight include weight.,3cb238fc-e348-4602-9f56-83fcd3fa75b9,2026-04-05T20:54:57
LOG0000836,WARN,tx-processor,Within test sort politics employee receive low do year economic.,6106ffbb-34e2-4a7b-a1e2-2c0aa18f282e,2025-10-15T08:49:35
LOG0000837,ERROR,kyc,Cut piece campaign forward second too.,3cfe3b14-2fd3-4203-b800-49cca158d360,2025-09-30T17:51:32
LOG0000838,DEBUG,api-gateway,Set second big recently break whole reach ground.,fdd1142e-9d22-4ac2-99bd-1a198eea5596,2026-01-26T19:52:47
LOG0000839,WARN,kyc,Picture their I television.,4b29eeb4-a6bc-4782-95d4-2609bd4034ff,2026-02-22T18:15:05
LOG0000840,WARN,api-gateway,Produce positive reveal others fund unit.,133fcf63-edd4-4aa2-9f6d-347e01e98c5b,2026-01-28T02:45:47
LOG0000841,ERROR,tx-processor,Road behavior hand various through.,eeb39b81-6420-485a-b6e0-3f8e9299dd2a,2026-01-09T23:47:09
LOG0000842,DEBUG,auth-service,Enjoy decade explain traditional management audience computer a between.,f6da1512-e064-4cec-93b6-41acd2b71474,2026-01-27T22:47:56
LOG0000843,DEBUG,auth-service,Month near number mission near.,e06fee6e-387f-4bc7-9113-113084e06f34,2025-11-19T00:47:22
LOG0000844,INFO,kyc,Sure enjoy card health stage without not provide establish.,cd726360-bb11-4419-9963-51f2e3f6641c,2026-04-10T20:10:23
LOG0000845,ERROR,tx-processor,Include if phone smile no model.,df87608e-f504-4bde-b1c8-4c7de6ec60f0,2025-11-17T17:34:14
LOG0000846,DEBUG,auth-service,Know two statement difference media.,e753a00e-f64f-425e-a477-e0a18a447604,2025-09-30T00:53:19
LOG0000847,WARN,api-gateway,Simple focus student nor heavy impact sister.,8c068011-f56b-4684-aea2-99ee613ff9bd,2026-01-19T21:56:15
LOG0000848,WARN,api-gateway,Project but crime analysis include rate expert hear establish among.,7e0064c5-6746-4476-ba82-84fd2b041951,2026-04-10T17:32:14
LOG0000849,WARN,api-gateway,Growth usually practice political institution low.,57e69a80-821e-4671-8878-8d98f19ed2bd,2026-04-04T18:32:40
LOG0000850,INFO,api-gateway,Science lawyer note recent better senior need officer trouble director treatment.,97624910-be35-4bb4-9fea-e7cb7d0ec1ca,2025-10-09T23:24:50
LOG0000851,INFO,api-gateway,Personal make word what source know.,ccc3102c-6d87-4933-a9aa-f86fd24a1ac3,2026-06-02T14:24:30
LOG0000852,INFO,tx-processor,Country speak south property room with learn life.,b37343ef-2219-4615-b014-dc3e24bfff05,2026-04-29T14:04:47
LOG0000853,DEBUG,kyc,Just see indeed friend.,93641a05-86f6-49de-a710-00a0049e23e1,2026-05-19T22:04:56
LOG0000854,DEBUG,api-gateway,Window maybe option force green key improve brother beat media image.,ad42a4f8-3982-4945-8c4a-2a60776b9bec,2025-11-05T11:00:32
LOG0000855,ERROR,auth-service,Effect fish staff after go course politics part year.,f7202ba1-9d7a-4636-805f-1b7dff0208dc,2025-08-06T07:33:37
LOG0000856,INFO,api-gateway,Eight down gas senior process staff himself amount.,4935018b-d5be-4129-9a9a-3562370acbc9,2026-05-15T04:57:16
LOG0000857,INFO,api-gateway,Employee necessary executive better remember goal travel bar.,42eeaa2d-432d-4f78-a221-2616821542b6,2026-04-04T20:21:19
LOG0000858,ERROR,tx-processor,Cultural prevent new Republican people open understand defense.,c1c2aed7-a7e4-494b-9e6a-b2972daeb388,2025-11-10T11:19:56
LOG0000859,WARN,tx-processor,Available sense morning town to family today recent.,26ec1525-5727-4042-8f11-4a08e74ed3b3,2026-05-08T09:23:47
LOG0000860,WARN,auth-service,Continue result visit eight authority who change loss clearly wait.,58ac1fe1-d201-4d9d-b391-24554449f6ab,2026-05-30T06:40:24
LOG0000861,ERROR,kyc,Something task team receive than somebody center office.,0f88e10e-df49-45f6-9425-e8287a126271,2026-02-02T03:20:59
LOG0000862,INFO,tx-processor,Own sort thank condition less bank chance.,4fea893e-8f79-4a78-9877-0aaa659d65e4,2026-04-08T19:57:30
LOG0000863,WARN,api-gateway,Tree free forget turn ok nature student effect laugh she.,e43055af-473a-449b-8e02-80a7da4b9cdf,2026-05-12T06:30:36
LOG0000864,ERROR,kyc,Pm still state rate during.,43a69663-e7ac-4553-965f-f10f2e8dfb52,2025-06-13T05:12:29
LOG0000865,DEBUG,api-gateway,Side ever with little fire.,09d5fb9a-5761-4f90-936e-9a6ad0c73fa5,2025-12-19T01:43:56
LOG0000866,ERROR,tx-processor,Generation help stay bring you star into current view.,758c70b8-0bca-413d-89e9-70bfcfc9be25,2026-02-17T13:53:33
LOG0000867,INFO,tx-processor,Hold young gas range employee computer police hand whose.,fe6602b3-1073-463b-842d-7f177a2b0df9,2025-12-15T02:12:14
LOG0000868,ERROR,kyc,Southern president senior establish single.,f4f18be1-67fb-49f8-a715-c7eddd0e2e4c,2025-10-16T15:20:09
LOG0000869,WARN,api-gateway,Building contain some form partner cup director what.,58c0e0c3-9d39-4dd0-98f7-8eacdb4e8432,2025-07-04T23:05:11
LOG0000870,WARN,kyc,Herself worry avoid mother everybody.,9471b01b-9e28-4fc2-9dd4-b61529274fd6,2026-04-06T09:44:58
LOG0000871,ERROR,kyc,Machine music bit he support everyone my.,a5adce2d-d70c-467a-b6c5-2b050c6ebf86,2026-01-17T01:57:25
LOG0000872,DEBUG,tx-processor,Behavior test huge model moment modern individual.,fde45cbf-9dde-4c1b-a441-3b8ee7b84f08,2025-10-07T18:05:37
LOG0000873,INFO,auth-service,Suffer travel knowledge fund notice activity away look ball.,8ca2e58d-84ec-47a9-b34a-0d8c86f5433a,2025-07-13T01:26:58
LOG0000874,WARN,auth-service,At pass recently however threat.,f68a6ce7-4ea2-4cb2-872c-c4e0e86e253a,2025-07-31T20:56:32
LOG0000875,ERROR,tx-processor,Miss language maybe anything tree.,c9970230-9dfc-4d8b-88f3-8fee2ed34899,2026-04-18T07:15:21
LOG0000876,ERROR,auth-service,Leg win room those mission full much.,21c3970d-db63-4fe5-86b6-02eef9d523ec,2026-05-15T10:13:00
LOG0000877,DEBUG,kyc,Bed the someone region key real tell nice teacher.,c1ea2e5d-d689-4766-a106-cd1bf1fa8caf,2025-07-03T17:46:52
LOG0000878,INFO,kyc,Claim so include place believe discover agency town place bar wrong.,ca9fd64a-0826-46cb-9693-425b22bc5c11,2026-05-13T06:16:19
LOG0000879,INFO,api-gateway,Seven wonder statement environmental old cover.,a7bc9572-15b8-4ac2-993a-ab107e71a813,2026-04-12T14:52:12
LOG0000880,ERROR,api-gateway,Listen mission least mission institution magazine money nothing.,efad53e8-b487-4c0b-ba56-b93e114565fe,2026-05-24T20:13:21
LOG0000881,WARN,kyc,As significant center from act prevent serve.,6f4605cf-342e-418b-838a-9744b6991ed1,2025-12-12T20:37:12
LOG0000882,ERROR,api-gateway,Herself conference run beautiful strategy buy we during dog.,738e11b5-5862-4935-944c-bd010a1d5757,2025-11-23T22:46:00
LOG0000883,WARN,api-gateway,Natural low figure free friend start prove almost.,011e38ce-c810-40b8-97b2-d009631e68be,2025-08-19T16:00:49
LOG0000884,WARN,tx-processor,Democrat lot agency discover national morning answer character small.,70aad852-33f3-41dd-836e-a554ae9a1fbc,2026-02-06T15:06:53
LOG0000885,INFO,tx-processor,Under my behavior buy organization every respond measure paper.,8550929d-4769-4d81-a3b1-202b1e91da7e,2025-08-08T10:06:08
LOG0000886,DEBUG,api-gateway,Meeting travel everybody above property cell national model spend.,586b43da-62d7-4e60-b28d-722a2fd33809,2026-04-30T09:39:10
LOG0000887,DEBUG,tx-processor,Report away list hope guess husband.,82f8b818-9d46-426a-a26b-9d335802911b,2025-12-13T11:46:34
LOG0000888,DEBUG,auth-service,Across member my particularly way.,57e65cc9-bb91-40ef-a830-8f0179aceb58,2026-04-20T05:09:36
LOG0000889,DEBUG,kyc,Form paper indeed indicate look.,12d462f0-9200-406d-a02d-19d857472bfe,2025-08-12T05:11:48
LOG0000890,WARN,tx-processor,Smile describe course six forget return.,0763457c-eabe-4516-a94c-b34521db7476,2026-03-03T12:04:57
LOG0000891,WARN,kyc,Indeed lose compare senior.,d218ee9c-6f8a-48a3-b442-ecf5076322c7,2025-10-11T22:12:00
LOG0000892,ERROR,auth-service,Ago at task manager blue whatever executive mission.,39f52ed8-98c7-4090-80c7-686ddb9c1170,2025-09-24T05:21:44
LOG0000893,INFO,kyc,Health somebody half wear discussion national southern become very.,916b1055-3f5f-45bd-b408-548ad717970f,2026-05-13T05:40:25
LOG0000894,DEBUG,api-gateway,Sister debate probably never sing soon research social sound.,a37775ed-b7e2-4a83-9010-3d7594a8698a,2026-01-14T06:02:41
LOG0000895,ERROR,api-gateway,Model drug son authority race.,ad26a767-3c79-4316-991e-a41a9547437b,2025-10-20T20:58:10
LOG0000896,DEBUG,tx-processor,Throughout image health thing brother rest only they leg class send.,10a3bea4-7a55-45b3-bb75-5e674817ba54,2025-12-12T03:02:28
LOG0000897,INFO,auth-service,Ability society design play could stage issue big friend.,313ffab2-4d57-4f09-961c-68f7d66b40aa,2025-09-29T03:33:35
LOG0000898,INFO,auth-service,Seem learn some seem career hundred research fine discuss.,06ad8d49-66ca-441f-bb94-2ad9a94b2b35,2026-01-18T07:00:40
LOG0000899,ERROR,kyc,Discussion watch may reveal middle.,99c5592e-1d1f-40e7-9b45-851e6c251183,2025-11-06T14:15:22
LOG0000900,INFO,kyc,Writer ago should song side by experience drop everyone.,22c71c14-4416-44c7-892b-fce183ebe649,2025-08-05T19:25:43
LOG0000901,INFO,tx-processor,Likely but collection really attorney father huge believe away.,16bf4b6d-49a6-49e0-9afe-436925cf7c6a,2026-05-19T01:35:50
LOG0000902,ERROR,api-gateway,Road base nice specific participant.,8c19a8ef-310e-4200-b71e-9c08dc3352e1,2026-02-04T06:13:42
LOG0000903,ERROR,kyc,Agree policy suggest must law specific officer turn something control.,085b3e3b-4161-426c-a73d-f0f3ae6766d3,2026-02-10T16:38:14
LOG0000904,DEBUG,api-gateway,Cause politics determine employee so woman project director clear development.,444116ae-000d-4bbf-9c72-830809fd5940,2025-12-04T19:16:01
LOG0000905,WARN,api-gateway,Stock admit which staff pull whole drive always security soon manage.,2a3c74fd-9454-4e7f-a2b0-f299ab5481cd,2026-02-06T17:13:10
LOG0000906,DEBUG,kyc,Couple including kitchen green compare.,ec3f21e2-eff2-4b3c-be47-23bc51cf3339,2026-04-16T10:46:05
LOG0000907,DEBUG,auth-service,Type program face drive these account.,48f9a928-bc8d-455d-8f75-51c3b26ca054,2025-11-25T20:20:48
LOG0000908,WARN,kyc,Prevent particularly hotel very grow.,439f5d54-a06b-47b8-a091-ec39267a4ced,2025-07-16T18:30:43
LOG0000909,INFO,kyc,Chair garden fall have protect others often either.,2b618850-07fe-4878-a61e-7774fcb85323,2025-08-20T00:34:07
LOG0000910,DEBUG,tx-processor,Friend care early Mrs reveal rather music speech main peace.,c7ef93bf-3e85-43d4-9505-6d44033352df,2026-01-12T14:48:10
LOG0000911,WARN,kyc,Win red need share seat community including finish huge very.,c8e2900c-0215-44d3-89ab-e2f736c3d65a,2025-09-22T07:02:09
LOG0000912,INFO,tx-processor,Wind move wear risk degree your he responsibility respond.,de79f97d-420b-4bf1-859e-e189a0a410ef,2025-08-12T11:00:03
LOG0000913,ERROR,api-gateway,Pay decision very movie close see every person us.,11afc68a-6b35-4ca3-b8ff-3f66b700e630,2026-02-03T12:07:09
LOG0000914,WARN,auth-service,Within agreement fast ball realize wrong PM station city.,96094146-2a8b-451e-a67b-094b253624d1,2025-11-17T04:16:03
LOG0000915,INFO,auth-service,Someone not interview game evidence audience clear certainly free million.,294e7292-14f6-4aab-8c39-6400e5a2a332,2026-02-18T22:48:32
LOG0000916,DEBUG,tx-processor,Build project office not create man key.,c4e03e6e-5372-4835-9e4e-c39b38a4ac8f,2026-01-02T16:44:54
LOG0000917,DEBUG,auth-service,Cut sit ahead dinner rise capital factor.,b4387f6f-36cd-4623-bd93-393acc96124e,2025-10-21T11:18:10
LOG0000918,ERROR,auth-service,Door environmental other probably reality contain east chance per.,8fc41a8c-3ecb-4f38-84aa-14cb7d1f7438,2025-06-12T05:38:33
LOG0000919,WARN,api-gateway,Value take enough where think position I around.,c930593a-8024-4473-8f9d-8dfd5ad0e134,2025-11-20T22:37:28
LOG0000920,DEBUG,api-gateway,Into professor however their floor.,a48268b0-4ea1-4260-93e6-22fc2b7d340e,2025-11-01T08:04:31
LOG0000921,ERROR,tx-processor,Son value win why it project middle process we.,778497f1-dbc4-48a1-b0e9-18664316c8c5,2025-12-06T07:45:43
LOG0000922,INFO,auth-service,Side perhaps approach nice body executive big push central letter.,7804cfd7-d1d3-4eb7-84c2-8876160005e9,2025-09-04T10:20:46
LOG0000923,ERROR,api-gateway,Great stop difficult letter.,5bed815f-7b99-42af-9c51-03318f3059cd,2025-11-24T13:33:56
LOG0000924,ERROR,auth-service,Act we cultural drop audience letter run because gun remain.,70f3d615-b855-4bb8-8ca7-74da4beadd65,2026-05-22T20:35:24
LOG0000925,WARN,kyc,West prevent major bed whom guy model cold you.,f3100c58-04d8-452c-9a7b-0d4c303d76e2,2025-07-30T21:03:13
LOG0000926,WARN,tx-processor,Month year boy box special glass now.,ab8666e4-9db9-4c9b-acb5-81a67ad39bd2,2026-03-11T16:22:42
LOG0000927,INFO,auth-service,Check Mr language end world.,22beb937-a1d3-4418-a7a3-6f48442e82cc,2025-11-15T22:32:12
LOG0000928,ERROR,auth-service,Consumer father role home every determine have.,777ea4cb-552b-4a00-ae92-67377dcfc423,2025-09-12T21:55:14
LOG0000929,ERROR,kyc,Sometimes indicate it each future often whose international ready.,7f6dbb2c-7388-4345-a0e0-a4d45b23a609,2026-05-01T12:39:09
LOG0000930,ERROR,api-gateway,Most small full into step.,e8e708df-21e7-49bf-a2e1-62ff44bd3da8,2026-04-23T23:38:38
LOG0000931,WARN,auth-service,Cause agree white onto suddenly.,89904e9c-19cf-41ea-af32-8b16dbad6603,2026-04-28T13:00:12
LOG0000932,DEBUG,api-gateway,Person friend second together direction.,c8c37dfc-34b8-4eb2-9ee6-32f02c7645a4,2025-11-24T20:53:55
LOG0000933,INFO,api-gateway,Protect husband poor sea a they blue me body usually sister.,fa24fedb-fbc0-4050-a038-4eaf86e8fc6c,2025-11-28T04:02:16
LOG0000934,ERROR,auth-service,Born late issue wait southern try may religious.,15473389-2c30-42b0-aeca-5ed896c9ee09,2026-02-05T17:51:36
LOG0000935,WARN,tx-processor,Miss save very interesting course.,4ccd17f1-1059-41b9-a156-298f80131151,2025-12-09T02:29:05
LOG0000936,INFO,kyc,Rest either water still remember include.,5600a074-e525-4632-93a9-b68eabc58757,2026-03-30T10:03:52
LOG0000937,ERROR,kyc,Discuss sign population pretty different couple public require.,dcbad674-1fdf-4688-89f3-d931a4dbf4b3,2026-01-15T09:53:59
LOG0000938,ERROR,tx-processor,Section hard couple worry summer full.,b1e599d6-c1da-4eff-8dce-a629d9dd862c,2026-01-30T12:05:26
LOG0000939,WARN,api-gateway,By light when during quality five role choose professional.,dcecf642-d171-4562-aae7-a24ff5efb653,2025-11-24T19:05:47
LOG0000940,ERROR,api-gateway,Bag war firm hair already instead yeah against sense material style.,01e775f8-6211-41cb-9261-0fabec010609,2025-10-13T09:42:34
LOG0000941,WARN,auth-service,Including analysis simply certain party back top street.,c06f0b24-b542-4cac-a0aa-58117f7fb2af,2026-05-18T22:12:46
LOG0000942,DEBUG,api-gateway,Number make far fire kid certain.,7af2d0c7-5f4f-4526-a505-5b3d89a97a1a,2025-12-20T06:50:47
LOG0000943,WARN,api-gateway,Tax every improve spring sense movement her.,3ea6badf-7926-4744-8817-2b3d9334f4b5,2026-02-02T12:11:13
LOG0000944,WARN,kyc,Economic news defense moment institution eat.,c98f2b9a-6d20-452f-a423-a3611d338210,2025-08-05T13:22:12
LOG0000945,ERROR,auth-service,My prove sit ahead dream impact.,40b988ca-8c2c-4f7d-bdee-60534beb714b,2026-05-08T04:12:09
LOG0000946,INFO,kyc,To sea few last clear hope forget.,d043c502-f4b6-4924-b50d-558cf99adc17,2025-10-16T10:52:02
LOG0000947,WARN,tx-processor,Office past include all international.,f26d2db2-c2a7-4ecd-afc1-7dbc7950a7b6,2026-02-24T07:11:18
LOG0000948,DEBUG,kyc,From goal avoid look set similar over cause beautiful.,4ec595d7-ffe1-4929-b6a3-615838c3790a,2025-06-18T12:19:38
LOG0000949,ERROR,api-gateway,Doctor same join analysis shoulder.,5bbcd98e-33d2-4ad3-9e15-78ed4b46c92b,2025-11-07T19:56:25
LOG0000950,DEBUG,kyc,Probably which center together.,b2189e46-258b-4eb2-9b0b-b67d0e188edd,2025-08-11T01:07:10
LOG0000951,WARN,api-gateway,Speech environmental close deal collection.,2006a7d7-974c-4389-9800-655f82aef85b,2025-08-30T06:17:29
LOG0000952,INFO,kyc,Candidate mouth story this relate rate with level feeling.,a06b6542-4438-42c7-ad0c-2e8370cf630d,2025-07-20T21:18:35
LOG0000953,ERROR,auth-service,Different ten year science feel fall art pressure.,8c664960-9a9d-4437-be83-6b7879b5ad7f,2026-04-16T09:03:38
LOG0000954,INFO,kyc,Put decade record foreign significant way travel consumer build prepare.,71d223d3-d378-4cbb-a427-d9c62b4d1b74,2025-12-13T11:01:38
LOG0000955,WARN,api-gateway,Begin among house quite action summer.,b3f0a406-8b25-43c4-801b-cbce473f2b1f,2026-01-19T11:56:38
LOG0000956,ERROR,api-gateway,Her chance now citizen late choose experience fast yet affect popular.,fc9fe157-3299-4257-a537-34eb4597213c,2026-02-09T11:47:43
LOG0000957,ERROR,api-gateway,Bag describe prevent ready him store official ability already new.,38b18b1e-e439-4d36-996f-c64d80fd2d8e,2025-10-15T06:57:10
LOG0000958,WARN,kyc,Organization face page able new music run no.,e59415fd-7711-4bae-968a-0eed94fdc0a3,2025-10-19T20:08:44
LOG0000959,DEBUG,api-gateway,Republican mind condition tend.,18022a79-f9bf-47e2-87c5-6875d6c41560,2025-07-31T21:38:17
LOG0000960,ERROR,tx-processor,Mr yes likely Congress scientist girl model.,ee3856b2-c5df-4a1e-929d-de785eff044f,2026-05-08T22:47:24
LOG0000961,INFO,kyc,Service discover range day tough.,610119c7-bebf-452a-a94a-f1c6c7f8d72b,2025-11-04T18:59:27
LOG0000962,INFO,auth-service,Model identify join former friend travel only amount.,304fd609-c285-4188-8a4b-e4d698e13b07,2025-10-27T04:21:34
