log_id,level,service,message,trace_id,ts
LOG0000384,INFO,tx-processor,Owner listen subject gas few wait summer quickly.,4d023e8a-f476-45f7-b5a0-29654b4df114,2025-12-07T03:55:26
LOG0000385,ERROR,auth-service,Clear black process fine teach could or here heart.,43cfd85a-cc43-4326-a6b0-976a5b19298f,2026-02-27T01:11:12
LOG0000386,WARN,tx-processor,Wind oil what Democrat energy tree success white.,c5f4e18a-cc67-4db6-a258-c423d38a0df0,2026-05-10T07:31:46
LOG0000387,DEBUG,auth-service,Sea three sure police want defense surface impact five.,b68cb409-abe7-4dd6-8960-525627868dc2,2026-05-18T22:43:55
LOG0000388,ERROR,tx-processor,Save cut else more race color miss.,b18be521-eb82-4ba4-993f-c5a9817888d9,2025-12-10T16:50:21
LOG0000389,ERROR,tx-processor,Visit city fire likely meeting.,571a3870-67c7-49b9-8a2f-ad94818ce307,2026-05-19T20:51:36
LOG0000390,DEBUG,kyc,Language grow put PM land sit left even personal we.,da18c379-42f3-4fa4-b8a3-42f4d674e1fa,2025-11-11T09:20:58
LOG0000391,WARN,kyc,Cup shoulder own film light.,8fd6d36e-9514-4887-a595-286ece647c39,2026-01-07T21:56:42
LOG0000392,ERROR,auth-service,Dark one almost great manager best race.,5061b57c-ed23-4999-8457-0486d1403ea1,2026-05-28T05:32:39
LOG0000393,ERROR,kyc,Until leader item line that clear finally agent ready minute.,ddbf1c18-e2fa-4700-9a09-6d69a689797e,2025-12-25T22:38:14
LOG0000394,WARN,tx-processor,Himself old recent rate meet.,c1088e0e-d7f6-45db-b99c-f166500402d0,2026-02-03T21:20:48
LOG0000395,DEBUG,api-gateway,Help large nor next point hard.,98688e5f-2f27-4c5f-b1c2-072b88b6a47d,2026-01-14T05:35:04
LOG0000396,ERROR,api-gateway,Himself space foot Congress author eye head discover family.,98ed584c-f08f-4e42-9792-2e795ec42bcf,2025-09-25T08:01:08
LOG0000397,DEBUG,tx-processor,Tend floor fly indicate operation happy production hit.,65fb0184-cbfb-429a-948a-4efa1af7cfd4,2025-11-23T18:22:06
LOG0000398,DEBUG,auth-service,American certainly collection traditional boy.,05a07ce1-b24d-432b-9369-fb1d3c14db01,2026-03-02T08:01:15
LOG0000399,DEBUG,api-gateway,Long security group national.,c5c809d0-d334-43a8-a5bf-ffcc2bc1c6a8,2025-09-08T13:27:40
LOG0000400,INFO,auth-service,Official Democrat as identify risk husband.,f02a12cd-e2b2-46f0-98b2-19e5ae65394a,2025-10-09T01:57:43
LOG0000401,ERROR,auth-service,Expect usually family world bit.,8866ec38-779c-4a67-bc2f-2d8bc8724ee9,2026-03-11T01:35:33
LOG0000402,ERROR,tx-processor,Always player through affect win not practice special.,23e0710f-fe27-47f8-b128-62f242505631,2026-03-25T18:41:26
LOG0000403,INFO,kyc,World situation technology available never type four vote.,9bc724f3-8301-4761-bd8b-ce21ed1981ff,2025-11-22T12:51:31
LOG0000404,INFO,tx-processor,Arm group born apply single.,03456b82-71ad-4a02-8da7-752b13235256,2025-09-20T05:35:05
LOG0000405,INFO,auth-service,Give easy month compare eye everybody.,ac712705-e6ed-41d0-a89c-08cbe75e3c29,2026-01-29T05:19:19
LOG0000406,INFO,api-gateway,Turn itself expert morning nature sit decide onto together eight voice.,b6eccb59-2600-4d8c-ae17-42516853f7c6,2025-10-20T20:21:54
LOG0000407,WARN,auth-service,Again production nothing husband ok recent method so help though.,6c5b3a44-f5e0-4b37-92a3-adbbe3876920,2026-06-05T07:28:14
LOG0000408,WARN,tx-processor,Near group theory table ahead show include that sister ahead family.,27e13a07-a1df-499c-963a-0c85527acb7b,2026-04-17T12:39:18
LOG0000409,WARN,kyc,Growth environmental born animal theory require fear more message.,4955ea75-b7d2-4cc3-934c-7a7f6eba6921,2025-11-15T22:59:58
LOG0000410,ERROR,auth-service,Technology edge both so year safe center nearly environment sure.,adedd884-117c-4447-bb91-189a41c3833d,2025-12-15T03:14:03
LOG0000411,WARN,auth-service,Approach loss better miss investment country live.,b38a17a3-ec55-4251-8632-9dd08a54bb65,2025-11-21T07:07:32
LOG0000412,INFO,api-gateway,What few position particular well continue student.,5f214522-4951-41ed-84d6-27d04f96afc9,2025-06-29T01:21:12
LOG0000413,WARN,auth-service,Attack summer too realize live.,98047e95-92fd-4574-967b-c85e25c707f5,2025-06-28T20:57:28
LOG0000414,INFO,tx-processor,After hundred but theory boy community different laugh not.,44d764d1-8041-4584-814f-b3d72367347b,2025-11-23T06:23:37
LOG0000415,DEBUG,kyc,Candidate far loss save same western pick where include.,54c22887-9deb-4267-8eac-257d35867092,2025-06-30T19:50:18
LOG0000416,WARN,kyc,Quite husband guess it white they.,49180259-9021-434f-a110-aeb1a02743c1,2025-08-21T06:40:48
LOG0000417,DEBUG,tx-processor,Letter human dog treat color continue nothing quality.,a605140a-0146-4354-afde-7110d6908aa4,2025-10-09T20:11:47
LOG0000418,WARN,tx-processor,Write address dark different sort special white difference American.,1945958d-2bdd-4430-a1c5-d538a99201bb,2025-06-18T14:37:44
LOG0000419,DEBUG,kyc,Anyone me college begin account increase surface choice.,20ca3b8c-1034-4879-b5fa-d78d6f7f578f,2025-06-13T16:37:08
LOG0000420,INFO,auth-service,Number lot during trouble mention pay.,ad8ea8fe-d75a-4e00-9608-d829f1a143dc,2025-10-15T09:06:06
LOG0000421,ERROR,kyc,Hard hard leave white wrong could perform article security great.,9efaf466-447a-4974-a0d7-2fe7e92c2b96,2026-02-13T14:50:28
LOG0000422,DEBUG,api-gateway,Happen impact fear why guess course structure development red experience.,14802a7a-31ca-4637-b168-45a192c7a541,2026-03-17T03:17:29
LOG0000423,INFO,kyc,Stop hard recently through will husband.,cd76dc8f-aac4-4787-9deb-de10f6fea47a,2025-12-27T11:04:41
LOG0000424,INFO,tx-processor,Seat success possible lead support.,76518c76-09ea-4a5e-a697-8d3f2fcc1e75,2025-06-11T21:36:29
LOG0000425,INFO,tx-processor,Off base consider while his put listen pressure.,134934bb-9206-4f6e-9b2d-49b3bd8b2d92,2025-09-17T21:26:49
LOG0000426,DEBUG,auth-service,Young certainly kind ten record majority however.,5380c251-cc04-4583-9f60-e473145cfdf6,2026-03-13T19:23:01
LOG0000427,DEBUG,api-gateway,Personal write eye Republican might sister near young can food.,b043070b-eee3-48f1-a57d-bfe1a11e090f,2026-02-06T09:16:51
LOG0000428,WARN,api-gateway,Source development team week father share reason black.,5f21b91c-dcbb-40b1-9b08-77c56324991d,2025-11-30T08:21:17
LOG0000429,WARN,kyc,Voice board she approach age.,822b2564-f825-44cd-ba08-50efb18cac6a,2025-06-28T22:21:40
LOG0000430,ERROR,tx-processor,On foot would unit light itself.,522d6318-515c-4f97-a73a-270240b4fb07,2026-02-27T04:42:23
LOG0000431,DEBUG,auth-service,Partner success recently civil need my business much relationship consider.,1172737d-b5f8-469b-8906-57e2399de459,2026-01-26T01:27:20
LOG0000432,INFO,api-gateway,Receive power become break himself soon set enjoy.,dc2afb35-e622-48ef-9dc8-aeb2265b2a0c,2025-08-09T20:17:17
LOG0000433,ERROR,kyc,Down economic probably after fast international central about.,ca11e53e-c28d-4772-a269-cc337a400548,2025-09-18T12:20:30
LOG0000434,ERROR,tx-processor,Key happy member growth development if animal it show.,cef88005-88ec-4cb9-82e0-c9f58885fee8,2025-10-09T06:33:08
LOG0000435,INFO,kyc,Father themselves admit source woman body perform question right summer.,d3481e66-fe7c-465e-a52e-1b3478135d13,2026-02-20T19:44:53
LOG0000436,WARN,kyc,Customer long kid lot dog.,d897692f-6f4a-443d-a561-9e5dfd1c6d08,2026-01-14T16:20:47
LOG0000437,DEBUG,api-gateway,Increase decision bit white forward.,6aaf34d8-dd30-4e01-819d-e4ebd1f33da4,2026-04-01T20:27:09
LOG0000438,WARN,kyc,Fly say approach feel front get site white.,3727672a-cee2-4be0-9311-d41f6d157941,2026-03-11T08:52:21
LOG0000439,INFO,api-gateway,Notice technology begin main through.,fa46f05e-d102-4a35-9c9d-8403bcfeaf2d,2025-11-01T14:56:54
LOG0000440,INFO,auth-service,Stop talk represent answer good beat.,377c7545-2f59-48e5-b98b-03cf2446ee22,2025-12-28T18:02:30
LOG0000441,WARN,api-gateway,Enough final truth road suffer receive.,30902661-f270-4358-8c2e-1b874b707aff,2025-06-12T02:11:34
LOG0000442,INFO,kyc,Cut her official read different chance hotel.,e15b72e4-efe5-4fa2-9910-1002b5b8ce1a,2026-01-17T18:51:23
LOG0000443,INFO,api-gateway,Sea sell rather deal dark cold why factor.,a64e3f8a-b199-4c0e-930b-9cab445a2315,2026-03-07T02:21:13
LOG0000444,WARN,kyc,Couple lawyer consider face data.,6f5374d3-b4ed-410d-ae70-009ec7f49152,2025-10-14T08:39:13
LOG0000445,ERROR,tx-processor,Direction stage performance church rather big across south detail government.,ee316e28-40d3-4a37-b7ff-05c68e23c8e9,2025-07-16T03:07:29
LOG0000446,DEBUG,auth-service,Your agree subject either friend owner material.,09f8d4ce-f452-47a9-96eb-5022b4f23666,2025-11-05T08:32:36
LOG0000447,ERROR,kyc,Model fear agree quality nation staff pattern become.,3ace93c2-fe02-4395-bba2-11d8ffc0c013,2025-09-09T03:04:38
LOG0000448,WARN,tx-processor,Wife discussion already training begin five picture during.,d80d8603-381b-4ef2-beb4-790906656744,2026-03-26T04:00:39
LOG0000449,ERROR,api-gateway,Growth foreign short strong beat own true financial and.,4217ba35-5ec4-43f7-8172-f5ad2365eb53,2026-03-24T22:57:35
LOG0000450,DEBUG,auth-service,Enough nothing music decide establish five.,fbe63156-a924-411c-8e8f-5f5b3dbfb061,2026-04-12T18:53:48
LOG0000451,INFO,auth-service,Senior surface including set be media third significant citizen join animal.,4b6e0861-96ce-470a-9902-b9493de148d5,2026-05-19T02:55:13
LOG0000452,INFO,auth-service,Miss skin house movement quality between.,f5c52009-eea9-4ca7-a8c3-d1d5a9698445,2025-12-04T20:39:58
LOG0000453,ERROR,auth-service,While arrive remember huge size member shake.,2ae0427d-e491-4162-a4a0-acbd32a3620f,2026-01-25T00:27:14
LOG0000454,WARN,api-gateway,Run treat guy avoid Mr station.,2605336b-5075-4c56-a126-5ff24b66607b,2025-10-18T11:47:38
LOG0000455,INFO,api-gateway,Fine option story activity five painting.,f7f87bc9-80b0-4056-a3d1-769568de508a,2025-07-24T18:56:08
LOG0000456,INFO,tx-processor,Shake impact long those read stay store house unit somebody.,5526c78d-cbc5-44a3-9a2a-61fb33f4d8b6,2026-01-27T15:53:30
LOG0000457,WARN,kyc,Eye two across top public mention.,48f9b546-8522-47b1-bf33-8bccaf84a87d,2025-08-29T04:22:33
LOG0000458,DEBUG,api-gateway,Project across month early white store deep itself.,7a5af999-d4ec-45fa-8c06-aa990c5c9e83,2025-09-07T05:22:40
LOG0000459,INFO,auth-service,Responsibility work rise focus game produce pass last design.,b7fca113-7fe3-47e4-81af-f9d165f408be,2025-07-16T18:23:56
LOG0000460,WARN,api-gateway,Message soon bank partner lot far risk.,626e1d8a-bebc-4309-872f-0bde7172c6ef,2026-03-24T14:01:27
LOG0000461,WARN,api-gateway,Age word just light must service clearly head.,60af47e9-62f5-4aa7-a5f4-7b8b49058a74,2025-08-13T02:24:53
LOG0000462,DEBUG,tx-processor,Big doctor positive responsibility trial performance.,7b359e5a-a081-45e3-bb7d-218655853d40,2025-11-05T11:22:19
LOG0000463,INFO,auth-service,Feeling work represent community buy international.,c760cdb3-fdde-41d4-af80-aba4d393a322,2025-09-03T04:36:32
LOG0000464,ERROR,auth-service,With study thousand special.,a8e35817-32a0-4c2b-8f6f-a58b90360c1f,2026-05-19T05:03:29
LOG0000465,DEBUG,kyc,Resource sing view role after well.,c9a35b69-b43e-4752-bd2d-29f60fb71599,2026-01-23T12:28:37
LOG0000466,INFO,api-gateway,Give expect its hear center.,fda27278-903f-440c-bec0-d3655d10a687,2025-12-20T17:50:52
LOG0000467,DEBUG,auth-service,Road choose they again could training up hand goal all.,7f948564-ea4d-4131-9dfe-cb9fc6bc622c,2026-06-03T08:13:22
LOG0000468,DEBUG,auth-service,Involve establish society result decide reflect truth year sometimes.,ead3fd51-57d7-4d08-91c1-305954de50e7,2025-06-24T01:59:36
LOG0000469,INFO,tx-processor,Call direction view better once pass.,991ca8f8-1005-4b26-9d0c-84a639d723c8,2025-11-25T19:34:53
LOG0000470,DEBUG,tx-processor,Class ready manage board likely arrive current card.,93ff745b-c833-4414-8df8-94315486bb2a,2025-08-07T00:01:37
LOG0000471,WARN,kyc,Whether picture very daughter despite after five large.,77945c99-6afb-4949-9504-b2107c904323,2025-08-09T15:10:08
LOG0000472,INFO,kyc,Others perhaps author wear man near apply.,1bf7a265-9a61-4850-b2c3-c73bde93715c,2025-09-28T04:28:27
LOG0000473,WARN,auth-service,We over hotel among leader choice himself charge house base allow.,acfb3c9f-7713-4a85-9fef-c85966798422,2025-11-01T07:40:05
LOG0000474,ERROR,tx-processor,Before old size on trip.,cd4b40c0-a40e-447a-afae-75811afbc8ea,2025-10-22T09:32:34
LOG0000475,INFO,auth-service,Side book media evidence war one person challenge involve book.,c784fd2e-99f5-4eae-bf92-89e067af2f99,2025-09-03T11:17:11
LOG0000476,DEBUG,api-gateway,According hold fear commercial light.,a0894b6b-5400-4704-93a2-821a1226af71,2026-05-19T15:51:46
LOG0000477,ERROR,api-gateway,Per end sign make country.,5a88cb38-1948-45b4-8120-c01af7d358be,2026-05-19T19:33:27
LOG0000478,WARN,auth-service,Turn popular eye thus seem cut best speak arrive.,4ef195bd-d95c-460c-8142-5d237bd81280,2025-10-07T16:19:18
LOG0000479,ERROR,auth-service,Hope alone guess hot difference audience maybe all political.,7f17aa99-ab8d-45d6-8bb4-6c22d8e67079,2026-01-16T20:58:56
LOG0000480,DEBUG,auth-service,Development vote town director meeting page his.,dfdaccb3-210d-4564-a665-f0f82c009349,2026-05-02T23:57:06
LOG0000481,ERROR,api-gateway,Wall why production need thus former.,8b4cc3b2-ef82-486a-8662-614c7da65844,2026-01-02T17:30:18
LOG0000482,WARN,auth-service,Democratic near claim subject paper second board against these product put.,41530177-022d-49f2-b1f8-7b0341ec2ea7,2025-12-08T06:53:58
LOG0000483,INFO,api-gateway,Population every push top technology size movement most oil fear.,935e59d5-6a32-4f8a-8472-37d876508877,2026-04-02T00:28:31
LOG0000484,INFO,api-gateway,Station travel Mr year run election visit media stand.,f36d731d-23d2-4fc0-9ed4-777a39b8ced8,2025-09-14T23:44:46
LOG0000485,ERROR,tx-processor,Station month government section analysis purpose bit clear animal tree.,1eb31578-4280-4ebd-b292-c0d248563e63,2025-07-09T12:22:02
LOG0000486,ERROR,tx-processor,So pattern style or who challenge.,8c832887-8fb7-41bf-89bf-bd5b3ca4e89f,2026-03-08T10:52:04
LOG0000487,DEBUG,kyc,Remain government clear southern wonder bed south computer trade section.,5d0420eb-dcd7-4719-81ca-38ec6768a54e,2026-01-05T14:53:43
LOG0000488,WARN,auth-service,Amount resource thus party tough cost.,cfd123d7-2151-4433-9519-dd37d2800731,2025-07-29T05:26:35
LOG0000489,WARN,kyc,Race sometimes how necessary national safe until enter they new.,deea71cc-f074-4b04-9d5d-3e1040debfed,2025-12-07T09:27:16
LOG0000490,DEBUG,api-gateway,Media owner nearly people response let fear treatment.,7354dc2c-0edb-4d93-b1ed-7c7ef14ac21d,2026-02-15T10:11:01
LOG0000491,ERROR,tx-processor,Central century bill people word sometimes usually employee.,39c37a25-e6ba-4476-a0fd-2e17698b5382,2025-11-11T13:20:19
LOG0000492,ERROR,kyc,Half town serious family health.,c7d07fc1-b14c-4998-b5ba-e3dc194c2210,2025-09-12T16:26:04
LOG0000493,ERROR,kyc,Cut ok cup gun question season too mention.,75037b65-5fad-4aa1-a231-6bcfa5f03454,2025-08-19T09:16:57
LOG0000494,WARN,auth-service,Scientist central democratic control order.,b6da2650-01f3-41b8-a66c-8d68dae19241,2025-12-25T05:53:58
LOG0000495,DEBUG,auth-service,Skin prevent board whom control anyone theory better lot measure.,2b3934ed-2288-4052-9db6-e8e7c08069f2,2025-07-09T07:01:24
LOG0000496,WARN,kyc,Firm short visit course sound identify industry much.,de85d188-6c77-4087-8756-c18d67557b2c,2026-02-04T12:14:04
LOG0000497,DEBUG,api-gateway,Industry ball democratic blood represent heart main walk feel.,ea9d13f3-ebd9-44c8-aebc-e872a5e905b4,2026-02-16T09:48:19
LOG0000498,WARN,tx-processor,Key reason fact recently senior recently sport in station.,a66f07b6-0d60-44aa-9fe1-f80552185295,2025-08-04T19:15:59
LOG0000499,WARN,kyc,Hear water nature of young.,fdbf9fcf-a4a5-4f9e-83bb-2b2562a1809d,2026-04-05T01:54:59
LOG0000500,WARN,api-gateway,Analysis cell create light attention.,257f2d04-9dcf-456f-852f-62390598d9cd,2026-06-08T17:59:51
LOG0000501,WARN,kyc,Develop him believe top wind develop.,cc7507a4-8a92-4d77-97a0-47829d1f2737,2026-01-25T16:44:51
LOG0000502,WARN,api-gateway,Very however tax as entire tend successful prevent.,b32b823d-2b63-45b6-822a-089916173cf5,2025-06-23T07:26:20
LOG0000503,ERROR,kyc,Western thing use go assume agent.,a536458a-785a-4bf2-9280-91c68092784f,2025-10-08T23:10:45
LOG0000504,WARN,tx-processor,Several watch author rich sense history clear turn cold.,c510bb93-0642-4fb8-a563-0bdb244c629e,2025-08-02T20:20:54
LOG0000505,DEBUG,kyc,Conference skill personal reason add watch industry easy well someone.,89556eb8-e5cc-4b98-93a1-e6f1baee8ee0,2025-11-15T22:20:38
LOG0000506,WARN,tx-processor,Rich allow physical notice foot.,1fe5c131-3d1a-4a33-9953-34109ebcd4d5,2025-10-26T05:02:54
LOG0000507,ERROR,auth-service,By artist evidence save magazine buy job.,051f496a-1b74-4c26-b0ff-5414e1ecd8a5,2025-07-26T23:21:51
LOG0000508,INFO,api-gateway,Nation kind information compare put suggest adult.,1eb29b4d-50fb-4af9-829e-777cf5781e05,2025-10-22T12:34:06
LOG0000509,INFO,kyc,Best again sport rock cup state kitchen.,004396d5-7aa4-43b8-bd17-f9bc465aaab3,2025-07-25T03:52:23
LOG0000510,WARN,auth-service,Win party miss bank beat spend chair.,7b564c71-319e-4ff1-ac11-f57ca1df11b3,2026-06-08T10:09:58
LOG0000511,WARN,kyc,Serve catch carry view none involve like also.,2483edf6-6849-4d4c-a384-2559ca4fd11a,2025-10-30T12:21:32
LOG0000512,ERROR,auth-service,Baby begin together in history morning technology situation.,5bf61fcb-ab53-4ac6-b67f-5fbe7ef482fb,2026-06-08T13:41:11
LOG0000513,INFO,auth-service,Increase place her star current threat institution listen.,07e27042-79d5-45d1-854d-0d9e510ce6fb,2026-01-09T21:59:56
LOG0000514,WARN,api-gateway,Response notice know risk able difference price structure conference surface represent.,cfd31f62-cf15-472f-8c29-821231aa33fa,2026-01-08T23:46:19
LOG0000515,ERROR,auth-service,Condition audience street even join.,337827ec-8d17-40b0-9089-7cd350b5fa97,2026-01-22T03:05:36
LOG0000516,DEBUG,api-gateway,Five whole director look among hotel hair.,53ea4abd-3454-430e-9c6a-ed7cc6ecc419,2025-06-11T21:40:59
LOG0000517,INFO,auth-service,Girl behind police we.,0816e4e9-5a62-471d-b83d-c7a21de56baa,2025-12-19T03:41:03
LOG0000518,INFO,kyc,Kitchen up example base social take stuff.,fcbe4bdf-21d4-4333-a1ef-a87f9d89f3d1,2025-09-04T07:52:04
LOG0000519,ERROR,auth-service,Let why once work believe point every reach seven.,c2ff74fb-966e-4a30-9798-633f2d4bc34f,2026-05-03T06:31:35
LOG0000520,ERROR,api-gateway,Participant be good would building unit foot quickly.,6bb4a636-7927-494c-9582-f103a7ca502e,2025-08-16T13:08:26
LOG0000521,WARN,auth-service,Everyone for majority decide amount rate shoulder return.,2d43302a-3ea6-41ee-b2ce-5ae5ff377430,2026-02-04T16:13:43
LOG0000522,ERROR,tx-processor,Available letter color way realize could station sometimes month.,5bc39bf0-3a42-47e9-a53c-00c7dabb832b,2026-02-15T02:07:39
LOG0000523,INFO,tx-processor,Would still anything relate important else recent write follow face.,df45bdbe-d1ec-431a-bbc7-f547329bf0ed,2026-02-24T22:37:39
LOG0000524,DEBUG,tx-processor,Production probably we perhaps ready in.,daa30eaf-4af9-4517-881c-d58949c8beb1,2025-09-21T20:36:20
LOG0000525,WARN,tx-processor,Get data doctor responsibility letter.,32abaa7e-130a-458d-8db3-566a1490fe6e,2026-04-07T20:10:59
LOG0000526,DEBUG,kyc,Religious west star game situation Congress live itself.,c5dddb11-06b1-4915-9561-8cdca48d9778,2025-10-04T01:51:02
LOG0000527,WARN,kyc,Be act community enough long resource interview tax leave sound.,f23ab492-7a94-4640-9e6a-b609daf8e15f,2025-08-12T17:47:55
LOG0000528,WARN,api-gateway,Always record development car increase seat morning structure either war.,6cec28ba-ced2-45ac-b6ef-67fe04c3546a,2025-10-07T12:25:33
LOG0000529,INFO,auth-service,Now lead item hair Congress figure type.,c58c9183-7ca3-4de8-bff3-d717899b6394,2026-04-24T09:22:13
LOG0000530,DEBUG,kyc,Another something go onto challenge war page boy old economic.,c3ef94e6-5d5a-43fc-8340-84708f0e1841,2025-09-28T10:43:57
LOG0000531,DEBUG,kyc,Couple ten continue property friend low.,1bce89c9-1367-4a5d-a88d-13c636b988e4,2026-03-11T01:51:28
LOG0000532,WARN,api-gateway,Four represent learn close say me born.,4eb3b171-89c6-4cef-99c1-c9153c425822,2025-12-21T23:24:20
LOG0000533,WARN,auth-service,Identify western each stop health floor much human staff.,f90f9276-4ef9-4361-9b70-5e2215268225,2026-05-14T15:16:37
LOG0000534,DEBUG,api-gateway,Night item little executive director movie step section affect.,0db10487-b6e1-4bc8-8d85-a7c843ba175f,2026-04-14T09:48:43
LOG0000535,INFO,api-gateway,Soon although several really measure ahead rich full.,fb7cdea2-bc23-459b-bc6f-5f931c4ebb8c,2025-07-04T01:27:29
LOG0000536,WARN,tx-processor,New city push easy another measure.,b32b897c-52de-4c62-92ec-61f4b2819582,2026-04-20T04:28:33
LOG0000537,ERROR,tx-processor,Somebody speech fear speak though future bring house appear single.,ee405ddc-d156-40d2-a767-b9b0cf9f763a,2026-02-17T05:20:56
LOG0000538,WARN,kyc,Can floor production off scientist eight apply despite wrong.,88b98725-1645-4065-8011-5eb72908d794,2025-12-08T00:15:54
LOG0000539,WARN,tx-processor,Child whether number item parent many everyone finally through story huge.,f37fc349-1425-4b2e-926e-f158c69fac39,2025-06-14T23:21:01
LOG0000540,INFO,api-gateway,Them expert station laugh yourself hundred.,5edbfab0-b8b0-4b46-bdff-028f0e1f2726,2025-09-16T21:54:33
LOG0000541,ERROR,api-gateway,Contain five total north cold.,0a465248-e30e-42b6-a6ff-e1086ec96535,2026-03-26T13:12:08
LOG0000542,DEBUG,tx-processor,Thus hard fact worker drive.,194f668c-061a-4780-a4a0-c00bcd305e8e,2026-03-25T19:15:42
LOG0000543,WARN,auth-service,Knowledge couple model century would how wear not bag garden region.,3d256be5-fa13-409c-ba99-3dac699b4f63,2025-08-21T04:15:12
LOG0000544,ERROR,tx-processor,Several audience today position reality party section dinner challenge.,d7121d30-a84b-4a08-9b8c-0303316d67fd,2026-01-24T16:13:53
LOG0000545,ERROR,auth-service,Worry later far step.,9d50950f-762d-4933-b460-953640161bd5,2026-03-27T07:30:08
LOG0000546,DEBUG,api-gateway,Sport million everything artist bit natural.,93dd800a-278c-4cc6-a274-99d47aa8204b,2025-06-17T11:10:07
LOG0000547,INFO,tx-processor,Whose notice best particular its fire never heavy attack.,14be05a7-73ca-4497-9402-05747c8b1965,2026-04-18T16:45:55
LOG0000548,WARN,auth-service,Themselves high which fact.,8949db62-5026-45f1-aae8-cac3ea5eef0a,2025-08-13T13:19:33
LOG0000549,DEBUG,kyc,Help task system address peace.,2c54c604-0c1e-4ddc-8a62-30c09fc29219,2025-08-19T09:11:36
LOG0000550,WARN,tx-processor,Stage listen shake local.,0f2617c7-2057-48a4-ba9b-0e36caa849a4,2025-11-25T20:08:14
LOG0000551,WARN,tx-processor,Government day mouth analysis economic include her.,8ae7b601-d406-44aa-bd2d-c17d5dc9b69f,2026-04-28T22:02:05
LOG0000552,INFO,auth-service,Natural bag but body also chair ground.,75b627eb-bd55-46b1-8f86-0872813f0eff,2025-08-29T19:56:53
LOG0000553,ERROR,kyc,Religious break condition join out heavy bed free.,9edde225-d80c-45ed-86e9-c004c4e115d5,2025-10-18T05:58:12
LOG0000554,DEBUG,auth-service,Meet leave lawyer former work though least drug dream.,d3182974-7a0b-4448-a4cd-75d34c954996,2026-03-04T20:31:28
LOG0000555,DEBUG,kyc,Mouth door art moment his baby.,433aa678-9a10-43ba-8b2e-7d226748803e,2025-11-02T05:16:46
LOG0000556,INFO,api-gateway,Certainly growth hotel be similar like will account rest.,4ca2d831-8bde-45c9-ac1a-a54d7e98f9d5,2026-02-11T05:00:18
LOG0000557,DEBUG,kyc,Notice choose benefit rest both they write anyone.,df93c623-f4af-4d97-a8bf-1d51a48e3414,2026-05-10T12:51:57
LOG0000558,WARN,auth-service,Responsibility today authority imagine why again early above former deep first.,8ca29a6d-5233-45b0-a4cb-ebf83ec5527d,2025-09-03T11:05:06
LOG0000559,DEBUG,kyc,Most space Congress decide hold build follow few too.,b33424c6-e8d7-4460-8da7-e90c2092cf49,2025-06-20T20:22:22
LOG0000560,ERROR,kyc,Give appear compare federal thousand course.,7aac1f8d-bb2e-4a71-9aad-1f4d1d400620,2026-03-02T17:23:38
LOG0000561,WARN,tx-processor,Establish always right candidate.,63559ad3-74fc-4fe1-9e76-352b6feecc17,2026-06-04T00:27:52
LOG0000562,WARN,api-gateway,Reveal trip truth again begin south its north feel message.,29edc1c5-8a02-4c77-92e0-9ca172c8acee,2025-11-27T05:36:18
LOG0000563,ERROR,api-gateway,Reflect beautiful peace tonight political follow.,d27becb4-b5ec-4999-ac1f-0c814b7dcea9,2026-03-31T13:56:45
LOG0000564,ERROR,kyc,Production film development test less brother yet moment themselves safe.,c47798fa-7242-41f7-895a-fcd891bc6db9,2025-08-25T19:20:46
LOG0000565,WARN,api-gateway,Region huge college involve draw store pattern detail town magazine.,29c8006e-a4eb-4070-b57e-747ca94b7118,2025-09-21T18:53:26
LOG0000566,DEBUG,auth-service,Heart reduce suffer enter official within tend price degree mind if.,e5454916-4753-4fa8-82a7-96e7d7ac57cd,2026-05-07T20:48:21
LOG0000567,INFO,tx-processor,Letter employee continue meet a might course position western investment.,a3a32bba-ad58-4959-9f2f-daec6c93421e,2025-08-06T23:48:09
LOG0000568,INFO,auth-service,At career blood writer experience science idea.,1006548a-0615-47ae-b22f-0eb0a45a8824,2026-04-06T07:46:34
LOG0000569,ERROR,kyc,Wrong policy have property whole idea specific.,316073c7-597f-4f0b-904e-412f99aad3fe,2026-01-09T05:25:53
LOG0000570,ERROR,auth-service,No why speak thank head rate traditional against approach offer.,9248c9f0-fa3d-4520-af8d-f310d8bca218,2025-08-02T20:34:57
LOG0000571,ERROR,api-gateway,Article theory garden speech drive amount indeed cultural be.,e739dd84-5ec0-4047-a6ea-8080623d32cc,2025-11-27T09:03:24
LOG0000572,DEBUG,auth-service,Air indeed tend seek floor cultural.,1bb554ef-f349-41e0-94ed-c352cbd3d73c,2026-04-29T01:22:17
LOG0000573,INFO,api-gateway,Pm find mother reduce.,514977ee-ee71-4286-9823-c71f26f221ed,2025-11-21T12:41:31
LOG0000574,INFO,kyc,Ok other pick investment week ask others opportunity question of.,d018c284-1a07-48e1-9823-7a5da8c5141a,2025-10-05T22:47:13
LOG0000575,DEBUG,auth-service,Find protect evening network wrong.,97c8c154-96f4-4378-8d89-13fc9045f033,2025-06-19T17:50:13
LOG0000576,WARN,tx-processor,Whether subject student produce lose president prepare begin general girl.,f8cd0485-a96b-4ff0-880b-6fb0d2175f8d,2026-06-07T04:04:03
