log_id,level,service,message,trace_id,ts
LOG0000000,WARN,kyc,How police American work decision someone idea impact.,7c7f9baa-50bf-4637-92f7-5e430b600f08,2025-09-05T16:31:03
LOG0000001,INFO,auth-service,Admit central especially share brother although movie consider far.,3af4ee3d-faea-4e28-814f-641fc560d0de,2025-12-02T08:59:15
LOG0000002,ERROR,auth-service,Democrat gas run test to college whom although resource.,e1dfdab5-fcb6-4f12-87ef-ae07db5761c1,2025-11-11T01:00:22
LOG0000003,WARN,api-gateway,Spring air ago church site summer only oil.,99d85cb6-e1cb-4751-98e7-4dd70449dcee,2026-01-01T19:47:16
LOG0000004,DEBUG,kyc,Yeah window instead teacher service.,55484ac9-b6e6-4f92-b295-1522406934c7,2026-03-31T01:18:42
LOG0000005,DEBUG,auth-service,Pick world fast answer person summer parent choose.,4aa8a5c5-9fb6-44fa-ae95-9aa0c256d275,2026-05-10T09:45:48
LOG0000006,WARN,api-gateway,Account such use agreement education cover religious hot international stay.,9826fda1-9582-4556-b718-1170aed350ea,2026-03-14T21:44:29
LOG0000007,DEBUG,api-gateway,Subject treatment before try poor range will fight low.,209746d0-fc87-46dc-842a-b4bd1b8eafd3,2025-06-23T17:42:00
LOG0000008,WARN,auth-service,Whom color current place best democratic perhaps product short.,b57bc75b-ee82-4bc3-9776-24d722c3bfc7,2026-01-08T05:09:55
LOG0000009,INFO,auth-service,View expect economy game ok rock yeah to.,e1765725-4648-482e-8e59-845cba43b33a,2025-08-15T09:07:26
LOG0000010,INFO,tx-processor,Look gas those show sort party value black seem.,625e10e9-3097-4e8f-91d3-574cf6aa4a73,2026-02-03T19:36:25
LOG0000011,INFO,tx-processor,Soon list amount remain behavior fight force subject size look rest.,90e153c8-7707-4fc6-8c52-005f5bdcc869,2025-07-06T05:24:24
LOG0000012,WARN,kyc,Increase trouble enter capital true.,b93f121a-5c6e-4be4-8715-ba2939d1984e,2025-09-28T04:47:19
LOG0000013,WARN,kyc,My begin how attorney someone.,7d74e348-778e-4611-b840-599eb3647897,2026-02-08T00:37:23
LOG0000014,DEBUG,tx-processor,First daughter theory teach western behavior wide question.,7222c132-a4c3-4180-b49f-adbb347ae607,2026-03-02T21:28:30
LOG0000015,ERROR,kyc,Create participant push plant remain manage.,f84fd09c-dfe8-4dff-9b4e-e311bc2bf816,2026-04-14T10:02:28
LOG0000016,ERROR,api-gateway,Score write magazine almost be sign mention speech.,03c8d8a6-7c34-4e84-a858-0caf492a4224,2025-06-16T05:51:36
LOG0000017,ERROR,auth-service,Event method during few issue clear nation on behind entire bank.,9a24120c-26cb-4a27-b5cc-d314eef7eb11,2026-03-26T03:59:13
LOG0000018,INFO,api-gateway,Lose friend pretty staff center wait nor PM.,9a2dbe4d-b626-4662-826a-205063bde302,2025-08-05T12:28:00
LOG0000019,DEBUG,kyc,Race stage table strategy cultural white sometimes before let.,cd6fcc1b-7375-4d0e-93eb-11b4f2e8ac1f,2026-02-17T19:45:30
LOG0000020,DEBUG,auth-service,Send per nearly garden together.,844d717e-a27c-4c99-a1e6-10b761e34320,2026-04-23T17:38:44
LOG0000021,DEBUG,api-gateway,Very field rather man table grow section bank apply finish.,ca0e3621-7799-4be9-a9aa-27a3511890a9,2026-04-30T11:54:26
LOG0000022,INFO,kyc,Model according sense begin actually.,ac9f35c3-ac00-492e-b3fa-24e5aa396c47,2026-03-23T05:37:39
LOG0000023,INFO,auth-service,Hospital fine letter reach sort meet factor positive.,e8945e96-ad4e-4d4d-aa78-27dcba849513,2026-06-07T21:35:57
LOG0000024,ERROR,api-gateway,Work me class fine week under language dream.,aab7509f-69ca-40b6-aa91-60dce384bed7,2026-01-19T18:39:08
LOG0000025,ERROR,kyc,Knowledge should build become include fire explain.,488115fa-082e-490a-b701-ec0332a84c60,2025-10-05T19:59:50
LOG0000026,DEBUG,tx-processor,Better many old think lead blue sometimes hospital will task.,14fa2a59-9299-4fb9-9bea-3085501dac13,2026-01-11T16:26:18
LOG0000027,INFO,kyc,One although glass federal special compare health game large risk.,59116204-298b-4a0b-a7a1-cbc02320d492,2026-02-12T10:02:33
LOG0000028,WARN,kyc,Ahead network sign but economic field institution card hotel.,77290be9-7c09-4464-aa1f-f6b6873621f8,2026-04-03T23:05:44
LOG0000029,WARN,auth-service,Should option rock happen budget dream apply party.,c8840c2f-71ea-4b4d-8209-4f8812b35a05,2026-01-14T16:07:06
LOG0000030,DEBUG,kyc,Concern international free brother what population husband fish.,d1604553-ec9d-4d0b-a783-c7f8d2bf1278,2025-07-12T22:58:17
LOG0000031,DEBUG,kyc,Hair positive according population teacher down age.,73d43189-e280-476c-82ee-1ea51c43814b,2025-12-04T01:31:47
LOG0000032,WARN,api-gateway,Others may figure author most newspaper other value herself medical pass.,f53fc576-1f4b-4c41-a101-4a0901b70620,2026-03-08T16:34:39
LOG0000033,INFO,kyc,Draw head walk outside over medical room consumer cultural understand window.,69482b66-2c54-432b-9f15-2e5ba369d342,2025-12-27T12:17:17
LOG0000034,DEBUG,kyc,Quality floor scene sometimes eat space.,dad4f318-076d-4ef4-82e2-e4cc6f646e36,2026-03-24T10:24:20
LOG0000035,INFO,tx-processor,Pm left situation strong near.,678dbe17-fed4-4079-bc7b-38199b21efdb,2026-05-15T14:32:15
LOG0000036,DEBUG,auth-service,Onto college evidence chair system away onto heavy finally.,c5989465-70f8-44b9-a30e-45db8c9f1cd9,2025-12-03T16:27:25
LOG0000037,WARN,kyc,Factor health anyone big cut.,078e737d-f1d3-4731-a495-1f271e697c85,2025-10-02T06:37:54
LOG0000038,WARN,kyc,Recently build change identify project.,fd444e01-0bf4-4a35-9d3d-7004c799f0d5,2026-05-05T04:30:48
LOG0000039,WARN,auth-service,Adult government anything stock serve stay.,b644bf03-7a6f-4a10-bb1e-8c1d6f7e7d35,2025-06-20T22:09:15
LOG0000040,ERROR,api-gateway,Program want fire end air.,e8d5468c-f8f8-4a20-aae0-0b892cce6868,2025-11-18T08:32:09
LOG0000041,DEBUG,api-gateway,Series yard decade wife prevent surface school.,5ef444ce-3d1b-40f1-8088-8ecacf5b814d,2025-07-30T05:53:15
LOG0000042,WARN,kyc,Believe clear country catch source.,5c1df3cd-da82-4fdf-8c28-a94d13a51eba,2025-06-13T20:03:18
LOG0000043,DEBUG,api-gateway,How upon who modern account democratic politics seek.,59ad49ae-1c72-46f7-a550-8475a89eec4e,2025-08-31T02:10:37
LOG0000044,DEBUG,kyc,Kid region public paper sing out stay standard.,ce735804-291b-418c-9f4c-c90b92194e15,2026-01-26T11:49:15
LOG0000045,WARN,kyc,You total real various wear investment.,ad563d23-6290-4cb6-badd-a269d4659cbd,2026-02-26T03:10:11
LOG0000046,DEBUG,tx-processor,Information draw should sea budget particularly.,520f0faf-7000-46fc-b747-4a1a11025e9e,2026-03-14T08:51:00
LOG0000047,INFO,api-gateway,Anything this wonder inside give drug clear.,ed064aab-839b-4268-8309-ddbaf87e93ec,2025-10-15T04:21:47
LOG0000048,WARN,auth-service,Price response response billion agreement general they recently senior know.,2f43a034-e362-4f91-9e17-1f866a7efcf1,2026-03-28T15:56:10
LOG0000049,WARN,kyc,Eye now fine visit move state public crime PM together.,1b94b68e-98fe-4e96-9315-3db74f51fa11,2025-08-25T16:53:54
LOG0000050,ERROR,auth-service,Western company evidence section last loss find beyond process forget thing.,2bb9c80d-2001-4e7f-a856-ebb3f6bae58a,2025-09-21T09:42:19
LOG0000051,ERROR,api-gateway,Safe under say loss provide through upon option.,b94a5a5f-df2d-4143-911e-fc42675c679c,2026-02-12T14:43:40
LOG0000052,INFO,kyc,Human price Congress game mouth suggest.,6fcdd004-e61c-4b8c-a387-c49f91cc350a,2026-01-17T18:50:45
LOG0000053,WARN,tx-processor,Of sound myself expect none.,f7a41b11-e9d5-46f3-ba82-968961ccfca3,2026-01-09T23:21:27
LOG0000054,DEBUG,api-gateway,Outside local position table tough factor town.,f7449707-8b55-4e69-8012-8b433309d2a6,2026-01-15T03:21:56
LOG0000055,INFO,api-gateway,Result white throughout health nice tonight finally blood debate.,886af80e-a861-4b48-aa55-133d4a103379,2025-07-05T13:23:17
LOG0000056,INFO,auth-service,Coach close culture above heavy shake one social understand break.,f8250615-74f5-4fc7-8ec6-997d92b00c7f,2026-05-07T05:41:30
LOG0000057,ERROR,api-gateway,Let fly number keep article between top answer career as leave.,bf245e28-faa1-4c3f-b082-d1f9b229bc30,2025-08-04T10:18:44
LOG0000058,WARN,auth-service,Network entire field too author.,915c65a4-4862-462d-bc5c-9a69954b018a,2025-10-15T21:03:05
LOG0000059,INFO,kyc,Open door east later writer property page.,6662c55b-b139-450f-90ed-650c79363d9e,2025-07-28T15:29:55
LOG0000060,ERROR,kyc,Center town spring section decision include challenge box.,ef863a48-82d1-4e2b-bbb6-3620d1507741,2026-02-17T06:27:22
LOG0000061,INFO,kyc,Professional drug event five nature.,65128a77-21ec-4f8a-af67-4b661d944500,2025-06-14T13:42:39
LOG0000062,ERROR,api-gateway,Trip simply cover among reach to establish paper local officer.,fc67298c-8eb8-4e14-b50e-f18e33e62cc6,2026-02-18T17:14:15
LOG0000063,INFO,kyc,Result week lose perhaps dinner others note where occur.,35b1602a-b03e-4d55-adf1-bd8f236d0371,2026-01-15T10:09:20
LOG0000064,DEBUG,auth-service,Scene face strategy owner short arrive ask.,bfe513de-58b0-4cca-aead-b855f6a67748,2025-10-01T13:31:45
LOG0000065,WARN,tx-processor,Shoulder old season address feeling.,4137e701-6a28-4dcb-bfe5-59d116c92a2e,2026-01-22T13:15:37
LOG0000066,ERROR,tx-processor,Drug gun owner debate know something think plant once.,e718aab6-6e27-49e8-a1ba-b7505c7a4c7a,2025-07-30T16:27:21
LOG0000067,INFO,auth-service,Order follow few church left ball whole.,711f5024-d68c-41c3-ac40-6f0348cdcda8,2026-01-21T03:42:29
LOG0000068,ERROR,api-gateway,Professor effect reality much resource marriage stand cut level.,0f5cfa45-674f-43bb-a825-36ef0e254ea9,2025-07-21T07:42:50
LOG0000069,DEBUG,tx-processor,Yeah else country back rule.,50e11aa3-a1f2-44b0-b238-9fa021d86c3b,2026-03-05T03:04:37
LOG0000070,ERROR,kyc,Candidate also lead position kid.,9fad0336-8ac3-4937-b567-b941c9853f2f,2026-03-29T04:56:13
LOG0000071,WARN,kyc,Your weight money let difference individual.,e8888a43-3e6f-443b-be17-16150a7dcf0e,2025-11-22T06:30:45
LOG0000072,DEBUG,api-gateway,Blood nothing other test central them glass education third.,55b08248-fdc0-427c-8b12-b694ec75180e,2026-04-27T18:13:12
LOG0000073,WARN,tx-processor,Phone fly old only according true as think always prevent.,140cc4c4-5526-4e6f-a822-4fb9e5380ecc,2025-09-12T12:27:21
LOG0000074,DEBUG,auth-service,Couple kind suddenly open forward front.,bb17bf7a-79df-4358-8bc7-0952dfc9ea34,2026-05-23T05:16:00
LOG0000075,DEBUG,auth-service,Lay evening heavy painting understand mind cut.,e25531f2-9a78-45fe-b8af-af90c112e813,2025-06-29T02:24:38
LOG0000076,DEBUG,api-gateway,Expect at remain end security.,c775944d-e753-4928-80b4-ac932e11c854,2025-07-24T16:43:52
LOG0000077,INFO,api-gateway,Democrat some benefit store where apply fear.,ddb3eb18-30ea-43fc-b079-a2540339e6c8,2025-07-29T13:48:14
LOG0000078,ERROR,kyc,Smile president this him learn late event campaign tell no laugh.,229269a7-e470-47f6-a2d7-2f01a9f29244,2025-07-17T14:19:17
LOG0000079,DEBUG,kyc,Word although technology cultural consider home color court relate bill.,d3d91378-3a84-4bf2-a147-b89656015d9f,2026-01-06T01:28:16
LOG0000080,WARN,auth-service,Full minute three eat have behind medical.,6ec3889e-703b-4678-963a-4af6b9dbf829,2025-09-17T15:27:13
LOG0000081,WARN,tx-processor,Middle explain owner particularly support my may name.,c7ccae70-3353-4b63-b26a-394b7d642fa9,2025-09-28T12:17:51
LOG0000082,ERROR,auth-service,Star out exist price not American admit run material.,b4553445-3a84-4f93-9286-3ab169843705,2025-07-04T03:16:31
LOG0000083,DEBUG,auth-service,Bag share image science describe send gas price yourself decade.,e706f244-6ac1-4fa4-852d-dcca96505932,2025-09-28T02:01:11
LOG0000084,DEBUG,tx-processor,Near type such upon red western.,fef8f5e7-b653-4c45-8c74-7882c6fe6706,2025-11-06T12:52:18
LOG0000085,WARN,api-gateway,Treatment decision finally machine on then item area section.,bed01ecd-9c87-4aa6-aade-b615c914d1bd,2025-12-13T15:49:54
LOG0000086,WARN,api-gateway,Dream ready institution add enter case visit continue.,0746c10c-effc-4cf0-a458-c8878eca3ede,2026-03-10T12:10:12
LOG0000087,INFO,auth-service,Sister rate development reveal imagine number ever.,d93767ca-d784-4b7c-8088-24bca10040fb,2025-08-12T02:20:37
LOG0000088,DEBUG,auth-service,Goal parent yourself bag check unit network other.,f2e4ee3c-843b-49da-a736-bdb8a8ee2622,2026-03-29T12:45:02
LOG0000089,DEBUG,tx-processor,Write reason mother arm free.,b458680f-cf8a-4f8c-994c-b688f3482547,2026-05-23T09:04:45
LOG0000090,INFO,api-gateway,Possible call interest also food option hair image.,55c15943-1bd5-487a-a553-236eea79ca0e,2026-01-28T06:48:46
LOG0000091,DEBUG,api-gateway,Crime hear election task career ball very economic debate west.,026dd965-397f-4fc2-86f4-859ce4a10530,2025-07-25T07:22:46
LOG0000092,ERROR,api-gateway,Free market report anyone establish animal player teach believe.,6cade51c-208f-4ff2-adf2-e53ba6e8fb70,2025-11-23T00:35:45
LOG0000093,ERROR,tx-processor,Executive serious water blood hour knowledge people fish camera.,371ea3f3-899c-4a38-98be-0537193ca37f,2026-04-28T10:05:38
LOG0000094,DEBUG,auth-service,Way his trip policy subject fear dog why way business cold.,dfac5900-e237-4f52-ae19-0562313b9ca8,2026-03-11T17:55:27
LOG0000095,DEBUG,kyc,Might pass spring black institution.,4e9259dd-0016-41b5-a4e4-bbbd0e9321f7,2025-06-24T04:49:37
LOG0000096,WARN,kyc,Worry others employee eight despite station.,a8ab98b5-8f70-454b-948c-2db2f329451c,2026-04-12T15:21:46
LOG0000097,DEBUG,tx-processor,Around wrong herself member person tell low.,79bbc5ef-f359-4ccc-adb5-86c6ecad48fa,2026-03-11T02:36:05
LOG0000098,WARN,tx-processor,Green relate my money successful individual contain order anyone certainly.,798524e8-c186-4596-b024-def518018d8f,2025-11-01T10:18:12
LOG0000099,WARN,kyc,Fast discover almost well lead.,b0a81a69-8471-47b6-a172-2cd8d514e948,2026-04-25T07:57:56
LOG0000100,INFO,api-gateway,Pretty grow few turn speech.,1a1157ba-13ab-432a-8f21-8e895abea79c,2026-03-23T16:06:47
LOG0000101,DEBUG,kyc,Detail population education officer hard his meet condition.,7943c486-6ddb-4837-98dc-94e08886db1a,2025-09-24T15:13:08
LOG0000102,WARN,tx-processor,Even ago throughout serious.,124eb963-ca81-4f8a-9117-98663d8e3251,2025-11-10T03:45:01
LOG0000103,DEBUG,tx-processor,Name allow throughout short standard meet language time drop.,10a4d714-e02c-4a7f-a7f7-f393364b9eb5,2025-08-20T04:07:58
LOG0000104,DEBUG,kyc,Everything other agreement structure wind owner become Congress.,57d4edf0-92e1-439c-81a7-5bfb813a7ed9,2025-10-17T02:19:52
LOG0000105,DEBUG,kyc,Must issue measure Mrs experience nothing soon accept international by.,92a2db8e-10a1-4e63-9773-cea96f87bb7e,2025-08-09T13:48:55
LOG0000106,INFO,tx-processor,What account environment traditional top where send traditional although ground.,f52d7d9e-e0e9-4dcf-b44e-b99b65f355e5,2025-10-03T19:20:37
LOG0000107,WARN,kyc,Would draw PM give including among those entire player.,ebf779a9-6d5d-4573-a9d2-2fa87572f481,2025-07-28T16:40:09
LOG0000108,DEBUG,api-gateway,Seven shoulder kid child according nice local key.,d5b422fd-6adc-4c3f-850e-845ef9458941,2026-05-31T11:43:08
LOG0000109,WARN,kyc,Sense although feeling both always sing support career state manager.,fa3ab596-9977-47df-ab70-e51172db0d7a,2026-01-21T03:53:44
LOG0000110,ERROR,tx-processor,Free cultural yourself tend member.,4f8c11f6-bb1f-4655-a31c-40e9f279979c,2025-09-11T02:50:33
LOG0000111,INFO,api-gateway,Feeling term possible feel movement office.,337414f0-4b50-4bcb-850f-a0985334ff42,2025-11-16T15:58:08
LOG0000112,WARN,api-gateway,Democrat western late writer outside realize.,b38b9503-b77f-420c-91e5-b67dff7eaf64,2025-06-25T07:29:36
LOG0000113,ERROR,auth-service,Relationship president always owner general avoid purpose environment.,63d77b30-c47d-46c1-a12f-4227f772ed90,2026-04-18T23:57:22
LOG0000114,DEBUG,api-gateway,Sign executive eight chance candidate evening bar nature.,42014561-3f1c-4045-b98a-b0607a59936e,2025-07-08T07:10:08
LOG0000115,DEBUG,kyc,Agreement local four past hope piece.,5743956f-9bf6-4abc-8f74-11a182509a27,2026-02-18T10:20:17
LOG0000116,WARN,kyc,Religious others skin general drop large book financial.,2365f719-fcd9-4e47-be16-7ebe13784623,2026-03-20T23:08:29
LOG0000117,INFO,tx-processor,Film seven doctor drop compare today.,e37b5123-d656-421d-a864-925857445715,2025-12-29T05:16:52
LOG0000118,ERROR,tx-processor,Strong report direction success candidate nothing apply scene.,eefea727-5df5-4a57-aebf-eb8894ebb95c,2026-05-02T22:54:10
LOG0000119,ERROR,api-gateway,Throughout set agree area maintain model animal.,39be9344-2180-4f08-8ef9-6ef85bc8f55e,2026-05-13T07:49:23
LOG0000120,DEBUG,auth-service,Anyone these staff senior just word though quality lose.,cb31e3c0-b74b-4b33-9543-5353af2453cc,2025-06-20T00:58:45
LOG0000121,WARN,api-gateway,Class wait lot almost series present daughter newspaper.,957cf155-5d38-4f89-a451-1dbb715f8515,2025-09-15T14:33:18
LOG0000122,INFO,api-gateway,They high themselves store second window other song.,2f502de0-c01b-49b9-ad79-d614a1a092d4,2025-10-02T02:09:34
LOG0000123,WARN,tx-processor,Thank write join here someone compare.,228b2c94-6214-42b3-a438-e7bb5a77b6a9,2025-06-11T13:20:23
LOG0000124,DEBUG,api-gateway,Myself ago instead perhaps seat future become bank.,3265ce8d-7a5d-4740-bbbf-86d4378ecd34,2026-04-03T15:15:25
LOG0000125,WARN,auth-service,Family when off trade cover nearly plant also.,24ca9617-44b2-4ed3-99df-94e7f0cca70c,2025-07-21T13:38:28
LOG0000126,ERROR,tx-processor,Official fast agreement wonder us.,94b80de6-8883-4fca-870a-2b87c37cf84d,2025-08-11T15:40:38
LOG0000127,ERROR,auth-service,Method few office stay dark later.,1174f833-3013-4b0d-b94e-eebfcc92f292,2025-12-21T04:11:21
LOG0000128,DEBUG,auth-service,Into seem piece city plan commercial ago daughter manager.,bdb5529d-6ed6-42e2-ba7c-a09dac3f34ea,2025-06-30T18:33:59
LOG0000129,ERROR,auth-service,Him box career know modern item bring project.,1fc6479a-b822-471e-b92d-cd6d42cc87ce,2026-04-18T01:42:52
LOG0000130,DEBUG,kyc,Necessary like strategy realize but economic too require senior point.,73f2545f-f700-45d2-8b5c-ad898ebe66af,2025-12-03T20:46:23
LOG0000131,DEBUG,tx-processor,Popular for word morning win bank safe.,e281f8a4-36fb-4616-8ba2-10bac5f97974,2026-04-19T10:37:14
LOG0000132,WARN,auth-service,Game six sure laugh safe music which.,1ef58d46-f1b5-4347-a311-77331586903d,2025-07-23T17:35:24
LOG0000133,WARN,auth-service,Successful ability draw couple baby.,ef967aa2-9b19-4039-9ea3-631cf0e5a782,2026-03-01T05:39:24
LOG0000134,ERROR,tx-processor,Get dinner small yourself election beyond see.,6d1968c0-ec6c-4a7b-90ee-cc6f15079a1a,2026-01-21T12:18:41
LOG0000135,DEBUG,auth-service,Shake common hospital instead image.,9d2c8b4c-0e80-4a08-9e62-d988c4848036,2025-12-01T12:17:44
LOG0000136,DEBUG,tx-processor,My pressure certainly sometimes bit thing sea artist.,ae3d8076-e8b1-473d-ba48-5a5d534dc7c6,2026-04-27T07:12:18
LOG0000137,ERROR,kyc,Prove structure financial their serve.,4a7d07a7-aef4-45f2-be26-8f23ba5b5c18,2025-10-24T18:45:03
LOG0000138,ERROR,tx-processor,Energy material painting those call thing Republican base.,6c81fc62-eee6-426b-9ba3-42fd9b2735d7,2025-07-25T06:17:51
LOG0000139,INFO,kyc,Property base against already from get coach.,87c014c1-96c9-4e72-a929-b9c90eeea60a,2026-05-23T10:59:13
LOG0000140,WARN,api-gateway,Involve address stay current.,768f0786-9dd2-4e3a-8e45-a0cc2c4be0d4,2025-12-20T02:25:33
LOG0000141,DEBUG,kyc,So agency knowledge look glass kid court as road effort.,2eaccf93-1c71-405d-bde6-7a8706f9699f,2025-06-25T15:18:32
LOG0000142,DEBUG,tx-processor,Whom take understand reduce occur example at.,9540ec3c-11fb-4130-9dd2-dac1f9033eb4,2025-09-01T02:39:34
LOG0000143,DEBUG,auth-service,Record although what parent day see collection seven establish body.,af209700-5396-47e1-b17c-0e47d4fae32a,2025-10-02T17:30:28
LOG0000144,WARN,kyc,Possible travel push five serve change peace explain half student.,5c79fd47-2523-466d-9fee-4a0d3481e3ce,2025-06-26T20:45:54
LOG0000145,WARN,api-gateway,Under network thought ready these three social hit.,713a593e-55c6-4a32-83e7-8967a288ab7d,2026-03-31T01:40:14
LOG0000146,INFO,auth-service,Cultural economy choice north remember apply bed many few door.,689c02f7-15c1-4656-b87e-cd9bf5f9721f,2026-01-06T09:17:27
LOG0000147,INFO,api-gateway,Fight court enter action training commercial.,ed902157-8d54-47cc-8003-aa3d655c310d,2025-11-27T03:19:59
LOG0000148,ERROR,auth-service,Boy project method rate year foot even.,c445194b-230b-43e8-a08e-6a632ecf1b19,2025-10-04T16:45:38
LOG0000149,ERROR,auth-service,Republican lay happy especially participant summer bill.,d48398da-2087-4e51-a0e4-e28a80f5e448,2025-12-27T07:45:56
LOG0000150,INFO,auth-service,Lead season speak wife forget.,9f93627f-bae0-4440-804f-ae3da5fd3d25,2025-11-23T14:43:16
LOG0000151,DEBUG,kyc,Interesting model difference second party.,567faa09-5465-4edf-81dd-824778c9585d,2025-06-13T14:15:55
LOG0000152,INFO,api-gateway,Bring case foreign dream face against prove.,8ecb1371-a509-4db6-850d-f794e9914bfd,2025-11-01T00:43:02
LOG0000153,INFO,kyc,Story western indicate oil north study challenge.,d1b507e4-40cb-4b99-9b35-c62111184676,2026-06-06T20:08:27
LOG0000154,ERROR,kyc,Material when eight eight special town now fact among.,32d1b131-527c-4b84-99e2-34b707397bb8,2025-09-28T09:33:12
LOG0000155,DEBUG,api-gateway,Visit world draw management best school here information kid forward.,8bc4a963-bb6f-4f1e-9987-90820dbeae2b,2026-06-03T04:06:08
LOG0000156,INFO,api-gateway,Market book him yard.,cd21ae2a-ce90-4e59-83c5-cc891c40681c,2026-02-19T11:23:01
LOG0000157,DEBUG,kyc,Machine coach movie test send big into growth.,071dc9aa-fa1f-4d00-87ec-5b033b3eae73,2026-03-24T20:04:10
LOG0000158,WARN,auth-service,Accept across top top factor both shoulder management.,93ae34a0-73c6-447b-9b36-b4ba07afd8b0,2026-02-22T03:00:46
LOG0000159,DEBUG,api-gateway,Second program note budget sell blood trouble the worry build.,f6e2b461-aa4a-4f1c-a2d7-7aa8eb7fe3d5,2026-03-01T06:57:55
LOG0000160,ERROR,tx-processor,Cold possible final pay doctor base produce can.,7731cee0-8c87-45f2-ab96-793ef8b8d1ba,2025-06-22T21:55:37
LOG0000161,ERROR,auth-service,Up say result ground enough executive even move.,e6980ac6-83e1-4b75-89d6-6e46f2cf2b09,2026-06-09T05:39:23
LOG0000162,DEBUG,tx-processor,Address down door ball race none yourself campaign.,1a95e705-c162-483e-b3af-aef5e1edfcae,2026-01-24T09:27:19
LOG0000163,ERROR,kyc,Set major my water will eight environment bad off wait.,f382491e-6091-494e-b88b-866e54ce93c9,2026-04-19T15:24:11
LOG0000164,INFO,kyc,Specific series glass hotel I play.,cb5fc8a8-188f-4b5e-845c-13cd58db82ce,2026-03-19T00:33:14
LOG0000165,WARN,auth-service,Prove when couple what catch of.,19e8ac99-ab0c-4e1c-885b-1bf65571633a,2025-11-25T23:19:03
LOG0000166,ERROR,tx-processor,Among site list guess return station the difference.,3deff051-9dc3-4db2-bdee-7142583df087,2026-03-19T13:47:30
LOG0000167,ERROR,auth-service,Four front unit and go single word.,d00308d3-9861-4d45-945d-6ca2f8ea2b5c,2025-11-04T07:47:54
LOG0000168,INFO,kyc,Nature ball about perform site.,fa976fec-13c4-4abd-9fc2-b421cc0f9b26,2026-03-22T08:36:29
LOG0000169,ERROR,kyc,Shake look never opportunity small age finish him.,8cbc4d28-9525-41c3-9df6-40befbc48a4e,2025-06-12T08:16:20
LOG0000170,DEBUG,tx-processor,Public color finish something cause trial company lay soldier cover.,e020297a-4f27-488f-aa71-6f3da6c731b8,2026-01-01T16:06:29
LOG0000171,ERROR,kyc,Week experience and focus family man hear almost good.,4555069b-839d-4a56-ae0f-e6fa87bb0722,2025-08-23T17:09:49
LOG0000172,INFO,tx-processor,Poor according office learn benefit per prove huge author.,9a8a1eef-2cae-4270-9670-8f0c629ab2b2,2026-05-03T11:04:47
LOG0000173,INFO,kyc,Again my material policy upon response positive I.,35e9d9c3-5fdd-4e91-8155-0fc2e8ceecdf,2026-03-25T15:50:22
LOG0000174,INFO,auth-service,Style part need most region strategy anything.,014c6d4e-89fd-4847-b6a6-751c08d5faa3,2025-09-02T11:44:30
LOG0000175,WARN,api-gateway,Maybe network popular kid debate take likely those PM model.,579678ad-18c7-4804-bc89-16286eae3cee,2025-11-05T01:43:25
LOG0000176,WARN,tx-processor,Guess unit than now toward fight game sound.,04f4d52f-e898-4539-8e35-561651e24ec6,2025-06-22T17:09:14
LOG0000177,WARN,api-gateway,Drug red special deal law deal to consumer choice.,1e6c3c94-7455-4551-949a-dabc582c9a6d,2025-12-10T17:31:18
LOG0000178,ERROR,auth-service,Discuss each back shake teach.,6c03efb9-622f-425e-8eed-58decd7c987d,2025-11-02T10:23:44
LOG0000179,ERROR,api-gateway,Marriage little among hard without doctor once.,5c678110-f45c-40a8-9488-d4f241310588,2025-11-07T11:59:13
LOG0000180,DEBUG,api-gateway,Mrs purpose say space nature citizen.,333ecea3-6f6c-4180-b84b-86ea7a95be7a,2025-09-02T00:36:49
LOG0000181,ERROR,tx-processor,Quality such sound example check use majority main.,dea6efd4-118d-4ae4-82ef-eaa16532cc60,2026-02-26T19:35:41
LOG0000182,ERROR,api-gateway,Any next room office.,78fde0ca-e934-45ca-9214-fa5bc9cb0cd6,2025-08-10T03:43:38
LOG0000183,INFO,tx-processor,Audience ability art six former best majority.,2d9da9bc-9130-491a-a100-fd2ff3202ff5,2026-04-16T18:15:13
LOG0000184,DEBUG,tx-processor,Difference special hotel simply here kid drive college position.,bce77709-ff1b-437d-b575-4e65bdb83839,2025-10-27T18:49:34
LOG0000185,ERROR,kyc,Want under high nearly participant be industry many free nor.,6f37f8f2-ec3f-429c-a440-992d8c7160e2,2025-06-10T07:19:48
LOG0000186,ERROR,auth-service,Product woman medical now road reality week employee because none.,70135d3d-9c18-4133-ac21-5853332a599d,2026-02-21T12:29:06
LOG0000187,ERROR,api-gateway,Story activity item attention everyone history speak parent age great.,04b6110e-dad2-44a4-8cde-7110a71b71ab,2026-05-25T15:42:54
LOG0000188,WARN,api-gateway,Whether let happen military must quite just arm rock style.,00e1eff4-63d1-4fa2-9259-f19b0f2f1428,2025-09-20T22:19:13
LOG0000189,INFO,kyc,Right care certainly stay wife can.,9d732472-1e62-4eef-af1a-a40f9c63fe54,2026-03-20T23:35:33
LOG0000190,INFO,tx-processor,Away success get source feeling cause job.,3d5d8fd6-783a-4241-9f57-d38896c6f7b0,2025-06-11T10:36:34
LOG0000191,DEBUG,api-gateway,Ask avoid team recent authority surface.,eee2e1b4-306f-40bc-bb38-896b09e17a65,2025-12-17T01:13:45
LOG0000192,INFO,kyc,Side remain happy assume beyond early.,56abe370-0560-4da1-9ae5-a044b7275ab3,2026-05-18T19:47:38
